profile,pattern,period,uid,seniority_final,snippet
people_mgmt,team_building,2024,asaniczka_7c8d187e7e30c63a,mid-senior,"looking passionate, skilled, experienced DevOps engineers join ’ dynamic team building geospatial cloud database future, cloud platform, control plane. DevOps Cloud I"
people_mgmt,team_building,2024,asaniczka_52b11212e841f029,mid-senior,"ining business operations improving overall user experience. join small, expert team building server-side front-end software systems run marketplace.The ideal candidate pass"
people_mgmt,team_building,2024,asaniczka_1239b95fc8e04ac4,mid-senior,u’ll opportunity forefront driving major transformation within . FS Data Govern team building centralized platform executing controls ensuring data handling processes adheri
people_mgmt,team_building,2024,asaniczka_8a6973393413f623,mid-senior," Spinnaker Argo would advantage Proven experience leading agile delivery teams, team building, team management providing leadership guiding team meet expectations Experience"
people_mgmt,team_building,2024,asaniczka_32c90c354e2a3833,mid-senior, Systems Engineering languages (SysML/UML) concepts Excellent technical writing team building skills Understanding Software development principles U.S. Citizenship required 
people_mgmt,team_building,2024,arshkon_3895546825,mid-senior,"ng CI pipelines, local staging environments, helpful CLI tools. also assist SRE team building monitoring observability pipelinesBuilding infrastructure services used product"
people_mgmt,people_manager,2026,linkedin_li-4367513192,mid-senior,"s perception, analytics, operational insights. dual role serve technical leader people manager, guiding team cloud engineers contributing hands-on architecture, design, imple"
people_mgmt,people_manager,2026,linkedin_li-4387985631,mid-senior,"hands-on coding, systems thinking, prototyping. act technical multiplier rather people manager. hybrid position reports CEO expected work downtown San Francisco office 2 3 da"
people_mgmt,people_manager,2026,linkedin_li-4383826509,mid-senior,"** technical lead team six engineers building operating robotics data platform. people manager — lead architecture decisions, code review, design mentorship, setting bar engi"
people_mgmt,people_manager,2026,linkedin_li-4390661259,mid-senior,"deployment velocity, system reliability, developer experience. * leader trusted people manager hands-on technical authority. also provide reasonable accommodation qualified i"
people_mgmt,people_manager,2026,linkedin_li-4366637854,director,", design reviews, code reviews * Raises bar engineering quality without needing people manager **Nice Have** * Experience B2B SaaS products scale (multi-tenant, enterprise, g"
people_mgmt,people_manager,2026,linkedin_li-4384284624,mid-senior,"ta engineering, high-stakes product leadership. TLM, deep technical contributor people manager, guiding high-performing team ML Backend engineers solve ""technical moat"" high-"
people_mgmt,people_manager,2026,linkedin_li-4397060795,mid-senior,", you’ll support HID’s success by:** * Managing team: Assuming responsibilities people manager, especially setting goals, evaluating performance, planning training skills dev"
people_mgmt,people_manager,2026,linkedin_li-4386170746,mid-senior,"* **Implementation-focused** , support-only * **Hands-on senior contributor** , people manager * Strong emphasis **ownership, design responsibility, delivery impact** * Best "
people_mgmt,people_manager,2026,linkedin_li-4380812170,mid-senior,loyees within outside function organization. * Utilizes people skills available people manager tools critically impact growth individual within company career. * individual m
people_mgmt,people_manager,2026,linkedin_li-4298131124,mid-senior,"y operations next-generation AI applications. role report Director Engineering. people manager role, serve technical leader team, mentoring junior engineers, raising bar engi"
people_mgmt,people_manager,2026,linkedin_li-4392951675,mid-senior," + Willingness take initiative accountability + Prior experience technical lead people manager **Bonus points** * Familiarity technologies use including GraphQL, gRPC, Postgr"
people_mgmt,people_manager,2026,linkedin_li-4388732382,mid-senior,"uality. * Provides technical guidance junior engineers without acting architect people manager. * Clear written communication, strong ownership, bias toward shipping well‑tes"
people_mgmt,people_manager,2026,linkedin_li-4383648762,mid-senior,ated field required minimum 8 years related experience least 2 years experience people manager required.
people_mgmt,people_manager,2026,linkedin_li-4389094178,mid-senior,"entication products **Qualifications** * Current ""hands development"" experience People Manager Software Engineers and/or Security Engineering professionals. * Current Experie"
people_mgmt,people_manager,2026,linkedin_li-4379041745,mid-senior,ary Senior SRE Manager lead grow newly built Site Reliability Engineering team. people manager tech lead; strategic leader responsible architecting reliability roadmap. build
people_mgmt,people_manager,2026,linkedin_li-4362017206,mid-senior,"ts technical authority, day-to-day responsibilities include essential functions people manager. definitive technical team leader critical domain X platform. responsible deliv"
people_mgmt,people_manager,2026,linkedin_li-4386164949,mid-senior,"* **Implementation-focused** , support-only * **Hands-on senior contributor** , people manager * Strong emphasis **ownership, design responsibility, delivery impact** * Best "
people_mgmt,people_manager,2026,linkedin_li-4389780134,director,"development, including minimum 10 years design experience. * Minimum 10\+ years people manager experience. * MSEE, MSME, MS Biomedical Engineering highly preferred. **Special"
people_mgmt,people_management,2026,linkedin_li-4391158676,mid-senior,"ewing critical designs, guiding teams complex technical decisions. role include people management; impact comes technical leadership, sound judgment, ability turn ambiguity into"
people_mgmt,people_management,2026,linkedin_li-4312227391,mid-senior,ogies **What you’ll bring role** * 6\+ years experience technical leadership \& people management * Extensive experience using Agile DevOps methodologies build product infrastru
people_mgmt,people_management,2026,linkedin_li-4391718561,mid-senior,"eworks like LangChain, CrewAI, AutoGPT) automate complex workflows. * 1\+ years people management experience * 2\+ years experience Agile practices ***At time, sponsor new appli"
people_mgmt,people_management,2026,linkedin_li-4393077334,mid-senior, cost performance. * Scope \& Expectations * 100% hands-on engineering role (no people management) * Deliver production-quality code deployments * Work within existing architect
people_mgmt,people_management,2026,linkedin_li-4388705992,mid-senior,"another cloud service * 4\+ years experience open source frameworks * 1\+ years people management experience * 2\+ years experience Agile practices ***At time, sponsor new appli"
people_mgmt,people_management,2026,linkedin_li-4395209909,mid-senior,"ng tech track. , advance recognized technical expert without transitioning into people management. value deep technical expertise much leadership established clear career paths "
people_mgmt,people_management,2026,linkedin_li-4363602123,mid-senior,"or role** strong emphasis technical depth, system design, product impact rather people management. *Note: role part ML infrastructure engineering team involve applying machine l"
people_mgmt,people_management,2026,linkedin_li-4390496225,mid-senior,"another cloud service * 4\+ years experience open source frameworks * 1\+ years people management experience * 2\+ years experience Agile practices **At time, Capital One sponso"
people_mgmt,people_management,2026,linkedin_li-4392075691,mid-senior,"another cloud service * 4\+ years experience open source frameworks * 1\+ years people management experience * 2\+ years experience Agile practices ***At time, sponsor new appli"
people_mgmt,people_management,2026,linkedin_li-4380324424,mid-senior,"another cloud service * 4\+ years experience open source frameworks * 1\+ years people management experience * 2\+ years experience Agile practices ***At time, sponsor new appli"
people_mgmt,people_management,2026,linkedin_li-4389448936,mid-senior,"on SQL daily, pipelines end‑to‑end, operate strong individual contributor. role people management, delivery management, high‑level architecture — we’re looking someone enjoys bu"
people_mgmt,people_management,2026,linkedin_li-4375082574,mid-senior,"ructure making changes improvements **Supervisory Responsibilities** Supervisor/people management (\~15% time). Supervise team approximately 4-6 employees (e.g., bi-weekly 1:1 m"
people_mgmt,people_management,2026,linkedin_li-4397459491,mid-senior,"on, owns architecture decisions, leads complex development efforts. traditional people management role. Instead, it’s ideal someone leads technical expertise, strong decision-ma"
people_mgmt,people_management,2026,linkedin_li-4389966465,mid-senior,"another cloud service * 4\+ years experience open source frameworks * 1\+ years people management experience * 2\+ years experience Agile practices ***At time, sponsor new appli"
people_mgmt,people_management,2026,linkedin_li-4384168575,mid-senior,"another cloud service * 4\+ years experience open source frameworks * 1\+ years people management experience * 2\+ years experience Agile practices ***At time, sponsor new appli"
people_mgmt,people_management,2026,linkedin_li-4387534509,mid-senior,"on SQL daily, pipelines end-to-end, operate strong individual contributor. role people management, delivery management, high-level architecture - we're looking someone enjoys bu"
people_mgmt,people_management,2026,linkedin_li-4392088447,mid-senior,"another cloud service * 4\+ years experience open source frameworks * 1\+ years people management experience * 2\+ years experience Agile practices ***At time, sponsor new appli"
people_mgmt,people_management,2026,linkedin_li-4394239121,mid-senior,another cloud service * 4\+ years experience open source frameworks * 1\+ years people management experience * 2\+ years experience Agile practices
people_mgmt,people_management,2026,linkedin_li-4388741402,mid-senior,"another cloud service * 4\+ years experience open source frameworks * 1\+ years people management experience * 2\+ years experience Agile practices ***At time, sponsor new appli"
people_mgmt,people_management,2026,linkedin_li-4385890236,mid-senior,"experience cloud computing (AWS, Microsoft Azure, Google Cloud) * least 4 years people management experience **Preferred Qualifications:** * Master’s Degree * 9\+ years experien"
people_mgmt,people_management,2026,linkedin_li-4397310856,mid-senior,"on code, shipping features, solving technical problems end-to-end. role include people management responsibilities. work across mobile, web, backend, data systems, partnering cl"
people_mgmt,people_management,2026,linkedin_li-4379988233,mid-senior,road architectural influence across multiple engineering teams — without direct people management responsibilities. directly shape security foundation next-generation software-d
people_mgmt,people_management,2026,linkedin_li-4382605327,mid-senior,"+ years experience containerization orchestration Docker Kubernetes * 1\+ years people management experience * 2\+ years experience Agile practices ***At time, sponsor new appli"
people_mgmt,people_management,2026,linkedin_li-4392808227,mid-senior,"another cloud service * 4\+ years experience open source frameworks * 1\+ years people management experience * 2\+ years experience Agile practices **At time, Capital One sponso"
people_mgmt,people_management,2026,linkedin_li-4392418036,mid-senior,"ip complex technical initiatives mentoring high-level engineers, without direct people management. **Preferred Experience** * Experience ad decisioning, real-time bidding, dynam"
people_mgmt,direct_reports,2026,linkedin_li-4366753922,mid-senior," compared set objectives. **Supervisory Responsibilities** applicable. position direct reports. **Qualifications** Understand utilize accepted tools platforms, including limi"
people_mgmt,direct_reports,2026,linkedin_li-4362263846,mid-senior,"t individual contributions related UI engine development optimization. position direct reports Individual contributor. pride collaborative team accomplish this, office 5 days"
people_mgmt,direct_reports,2026,linkedin_li-4372162352,mid-senior,"help teams adopt common patterns quickly. * Mentor coach engineers (indirectly, direct reports) pairing, code reviews, design reviews, raising overall DevOps maturity across "
people_mgmt,direct_reports,2026,linkedin_li-4386464801,mid-senior,", infrastructure, data, message processing, prediction quality **Direct Manager/Direct Reports** * Position typically reports Software Engineer Manager Sr Software Engineer M"
people_mgmt,direct_reports,2026,linkedin_li-4393051304,mid-senior,"ript, Python, Ruby * Qt/QML Framework * Experience managing work technical team direct reports **Experience Least Three Following** * User Interface Development * Signal Imag"
people_mgmt,direct_reports,2026,linkedin_li-4362600062,mid-senior,"bal Technology management executive level positions. May individual contributor direct reports. ABS global leader marine offshore classification innovative safety, quality, e"
people_mgmt,direct_reports,2026,linkedin_li-4391942391,mid-senior," new solution ground open learn new technologies. **Some Do** **Scope Role:** * Direct Reports: individual contributor role direct reports **Key Responsibilities** * Design, "
people_mgmt,direct_reports,2026,linkedin_li-4356659377,mid-senior,"d-class customer satisfaction. * Train, develop, lead, coach manage performance direct report. * Supervise daily operations activities Power system engineering team delegate"
people_mgmt,direct_reports,2026,linkedin_li-4397535630,mid-senior,"ence Delta Lake, Spark SQL, Databricks Jobs. **Supervisory Responsibilities** * direct reports responsible project ownership may reports. * Responsible mentoring Jr. resource"
people_mgmt,direct_reports,2026,linkedin_li-4331186463,mid-senior,"embers, participate hiring process, onboard deliver timely performance feedback direct reports, execute/contribute performance appraisals annual performance cycle, utilize ta"
people_mgmt,direct_reports,2026,linkedin_li-4312091893,mid-senior,"loyees, participate hiring process, onboard deliver timely performance feedback direct reports, execute/contribute performance appraisals annual performance cycle, utilize ta"
people_mgmt,direct_reports,2026,linkedin_li-4358134709,director,"olving research goals. * Conduct performance reviews support career development direct reports. * Foster inclusive, collaborative environment; assist building diverse, effect"
people_mgmt,direct_reports,2026,linkedin_li-4256097596,mid-senior,"ork, mentorship, shared success. **Reports to:** Software Engineering Manager **Direct Reports:** None * Impact development design launching new 0 1 product * Lead engineerin"
people_mgmt,direct_reports,2026,linkedin_li-4379114882,mid-senior,"storing data, keeping records organized updated easy retrieval understanding. * direct reports **Preferred Job Qualifications** : * Knowledge LLM architecture, inference, con"
people_mgmt,direct_reports,2026,linkedin_li-4372620962,mid-senior,"hands-on technical leadership role reporting Director Platform Engineering, 1–2 direct reports start. partner closely hardware, firmware, data/AI, security, infrastructure te"
people_mgmt,direct_reports,2026,linkedin_li-4343554561,mid-senior," industry including hydraulics, pneumatics \& electromechanical solutions. \_\_ Direct Reports \_X\_ Direct Reports **Essential Functions** * Layout, design create hydraulic,"
people_mgmt,direct_reports,2026,linkedin_li-4392483811,mid-senior,structure code models; Drives keeping monitoring/alerting date **Direct Manager/Direct Reports** * position typically reports Systems Engineer Manager Sr Manager * position 0
people_mgmt,direct_reports,2026,linkedin_li-4391470650,mid-senior,"entic coding **What Looking (Qualifications)** * led team 4-8 engineers before, direct reports grew retained * shipped measured growth experiments subscription product (signu"
people_mgmt,direct_reports,2026,linkedin_li-4384889577,mid-senior,"vanced analytics, data governance, scalable enterprise data solutions. position direct reports, provide technical mentorship guidance junior mid-level data engineers code rev"
people_mgmt,direct_reports,2026,linkedin_li-4379454781,mid-senior,. **Reporting Relationships:** | role reports project manager initially include direct reports.
people_mgmt,direct_reports,2026,linkedin_li-4387583281,mid-senior,") - Front End Software / Opentrons Robotics Reports to: Team Lead, Applications Direct Reports: Location: Hybrid Long Island City (Queens) NY FLSA Classification: Exempt **Ab"
people_mgmt,direct_reports,2026,linkedin_li-4343396134,mid-senior,cross web applications CMS platforms. **Supervisory Responsibilities** position direct reports expected mentor teammates lead example influence. **Work environment physical r
people_mgmt,direct_reports,2026,linkedin_li-4379447968,mid-senior,"ng. **Reporting Relationships:** role reports project manager initially include direct reports. **Salary Range:** $95,000 - $150,000 USD Starting salary based multiple factor"
people_mgmt,direct_reports,2026,linkedin_li-4372866276,mid-senior,"g., Linux, Android, QNX) Hardware. * 1\+ year technical leadership role without direct reports (only applies positions direct reports). * 1\+ year work experience role requir"
people_mgmt,direct_reports,2026,linkedin_li-4326378691,mid-senior,xperience related work experience. * 1\+ year technical leadership role without direct reports. (applies positions direct reports) **To Staffing Recruiting Agencies** : Caree
people_mgmt,performance_review,2026,linkedin_li-4395730895,mid-senior," achievements big small company-wide appreciation milestone rewards. * **Annual Performance Reviews** : Regular opportunities feedback, growth, advancement. **Culture Growth \& Be"
people_mgmt,performance_review,2026,linkedin_li-4389409827,mid-senior,"e Infrastructure \& Operations Capacity Database team. role focuses capacity \& performance reviews, database SQL performance optimization, best practices, scalability, reliabilit"
people_mgmt,performance_review,2026,linkedin_li-4379445371,mid-senior,ancement program * Company equipment provided (Windows \& Mac options) * Annual performance reviews opportunities growth career development
people_mgmt,performance_review,2026,linkedin_li-4278837528,mid-senior,"al mentorship, career development, feedback, coaching * conduct regular one one performance reviews, addition leading projects helping team members lead projects. Creating support"
people_mgmt,performance_review,2026,linkedin_li-4366764716,mid-senior,"ridging Documents, Risk Assessments, CMMS audits, Leadership Field Inspections, performance reviews. * Lead investigations equipment failures process upsets; implement corrective "
people_mgmt,performance_review,2026,linkedin_li-4372769495,mid-senior," team software engineers working AR/VR training systems * Conduct regular 1:1s, performance reviews, career development planning, technical mentorship * Participate hands-on codin"
people_mgmt,performance_review,2026,linkedin_li-4392115550,mid-senior,"scalability. * Experience mentoring leading engineers, comfortable code reviews performance reviews—you lead technical excellence, org charts. * Comfort ambiguity custom problem-s"
people_mgmt,performance_review,2026,linkedin_li-4391195664,mid-senior," design, construction, testing, maintenance, supply chain teams * Manage vendor performance review contractor deliverables * Train mentor junior engineers * Present technical con"
people_mgmt,performance_review,2026,linkedin_li-4374173535,mid-senior,"ion, safety technical training Field Engineers Technicians. * ​Perform employee performance reviews recommend appropriate salary changes. * ​Coordinate technical training field pe"
people_mgmt,performance_review,2026,linkedin_li-4391229438,director,"ubernetes. - Balancing technical leadership people management: conducting 1:1s, performance reviews, career development planning. - Collaborating cross-functionally Product Growth"
people_mgmt,performance_review,2026,linkedin_li-4393032887,mid-senior,"ellence, automation, continuous learning * Conduct regular team meetings, 1:1s, performance reviews **Nice Experiences/Skills:** | * Experience GitOps progressive delivery approac"
people_mgmt,performance_review,2026,linkedin_li-4393207788,mid-senior,"sist manager work assignments, monitor team ServiceNow queue participate annual performance reviews. * Supports Engineers project management, planning estimating, reporting, sched"
people_mgmt,performance_review,2026,linkedin_li-4379416058,mid-senior,"SAE Industry Technologies Consortia (ITC), Performance Review Institute (PRI) SAE International (SAE), deliver shared solutions industry's co"
people_mgmt,performance_review,2026,linkedin_li-4358134709,director,"development work ensure continuous alignment evolving research goals. * Conduct performance reviews support career development direct reports. * Foster inclusive, collaborative en"
people_mgmt,performance_review,2026,linkedin_li-4397041343,mid-senior,"roduction support mission‑critical applications. * Support daily risk, pricing, performance reviews across complex asset classes. * Work closely traders, business users, quantitat"
people_mgmt,performance_review,2026,linkedin_li-4383622954,mid-senior,"entoring, performance management assigned software engineering staff. * Conduct performance reviews, career development planning, technical coaching. * Establish code review stand"
people_mgmt,performance_review,2026,linkedin_li-4368759713,mid-senior,ancement program * Company equipment provided (Windows \& Mac options) * Annual performance reviews opportunities growth career development
people_mgmt,performance_review,2026,linkedin_li-4337089562,mid-senior,"pet insurance, entertainment discounts make life easier. * Development – Annual performance reviews, tuition assistance, internal career growth opportunities help thrive. * Financ"
people_mgmt,performance_review,2026,linkedin_li-4379447115,mid-senior,ancement program * Company equipment provided (Windows \& Mac options) * Annual performance reviews opportunities growth career development
people_mgmt,performance_review,2026,linkedin_li-4391523767,mid-senior,"te staffing plans identify subject matter experts (SMEs) provide feedback staff performance reviews * technology solutions within area, including proactive monitoring alerting, te"
people_mgmt,performance_review,2026,linkedin_li-4379449147,mid-senior,ancement program * Company equipment provided (Windows \& Mac options) * Annual performance reviews opportunities growth career development
people_mgmt,performance_review,2026,linkedin_li-4381123344,mid-senior,"ll establish repeatable process periodically “scrape” collect skills collection performance reviews. * Candidate Team shall comply guidance policies regarding collection, analysis"
people_mgmt,performance_review,2026,linkedin_li-4323840538,mid-senior,"itable donations, employee handbook, dress code, coaching conversations instead performance reviews, walking meetings. PNC seeks individuals flourish type work environment add cul"
people_mgmt,performance_review,2026,linkedin_li-4394678488,mid-senior,"g plants, etc… * Experience troubleshooting, causal analysis, and/or diagnostic performance reviews * Expertise either sorption, filtration, ion exchange, catalysis (hetereogeneou"
people_mgmt,performance_review,2026,linkedin_li-4389946248,mid-senior,"te staffing plans identify subject matter experts (SMEs) provide feedback staff performance reviews * technology solutions within area, including proactive monitoring alerting, te"
people_mgmt,headcount,2026,linkedin_li-4323436622,mid-senior," wanted schedule candidates faster, track interviewer preparation quality, half headcount. recruiter needed manually collect availability candidate, identify qualified i"
people_mgmt,headcount,2026,linkedin_li-4323286939,mid-senior," wanted schedule candidates faster, track interviewer preparation quality, half headcount. recruiter needed manually collect availability candidate, identify qualified i"
people_mgmt,headcount,2026,linkedin_li-4324687392,mid-senior," wanted schedule candidates faster, track interviewer preparation quality, half headcount. recruiter needed manually collect availability candidate, identify qualified i"
people_mgmt,headcount,2026,linkedin_li-4384639034,mid-senior,"refer lead via rigor design documents, clarity thinking, consistency judgment — headcount, formal authority, direct ownership team execution. * Roadmap-first best work y"
people_mgmt,headcount,2026,linkedin_li-4323396575,mid-senior," wanted schedule candidates faster, track interviewer preparation quality, half headcount. recruiter needed manually collect availability candidate, identify qualified i"
people_mgmt,headcount,2026,linkedin_li-4393957585,mid-senior,ays/week) \| Remote (2 days) *This pipeline requisition posted advance approved headcount future hiring needs.* Note: team always interested speaking exceptional candida
people_mgmt,headcount,2026,linkedin_li-4389224286,mid-senior,"st three months * Work high-intensity, in-person environment focused excellence headcount, shipping real value global users daily **What do:** * Design ship end-to-end p"
people_mgmt,headcount,2026,linkedin_li-4323386766,mid-senior," wanted schedule candidates faster, track interviewer preparation quality, half headcount. recruiter needed manually collect availability candidate, identify qualified i"
