category,uid,source,period,company_name_canonical,matched_terms,excerpt
ai,asaniczka_356935bb96a9e3d1,kaggle_asaniczka,2024-01,Covestro,,"improve r& tailor-made aesthetically attractive intuitively , workflows, and/or virtualization entities, , , customers. interdisciplinary , incumbent coordinates , , r& digitally. tasks : high-impact full-stack , selecting maintain transact"
ai,asaniczka_17fb4480bf103cc6,kaggle_asaniczka,2024-01,Intellectt Inc,agent,": ( ) duration : 4+ : | (dcxe) team. scrum delivering front-end ’ agents. currently omnichannel ’ means ( , , , , …) prefer us. front-end bby platform. collaboratively maximizing stakeholders. : | contribute omnichannel bby ’ platform. 10+ "
ai,arshkon_3900978298,kaggle_arshkon,2024-04,Checchi Capital Advisers,,", , internally facing objectives. requires , self-directed , willingness motivation contribute ’ needs.primary - maintain - analyze robust - mappings disparate sets - existing - - , - , seamlessly stackabilities - - ingest, validate sets - "
ai,asaniczka_660d187f7eda3cab,kaggle_asaniczka,2024-01,Digital Republic Talent,fine_tuning,", , generative ai improve , efficiencies use-cases, | selecting needed (ml , governance, instances, , , ), analyse pre-process necessary, , choosing , fine-tuning and/or pre-training , proofs | demonstrable hands-on generative ai , mainly ,"
ai,arshkon_3901625867,kaggle_arshkon,2024-04,Morgan King Technology,llm,": closely founding adopters top-tier ai-driven product.design, , maintain backend , including server-side , databases, , needs.work hand-in-hand user-facing elements.engage entire , debugging, high-quality, code. requirements: wearing hats."
ai,asaniczka_6719c6e9953789df,kaggle_asaniczka,2024-01,ASK Consulting,,"duration: : | , , debug, modify , including data/etl pipelines. collaboratively , , components. quickly minimum viable duties: | troubleshooting issues. team. communicate geographically teams. participate critique others. robust , scala , h"
ai,asaniczka_0a7680bd9be7e5d1,kaggle_asaniczka,2024-01,Pinecone,pinecone,", ui/ux ’ console. , frictionless user , ml scientists. example include maintaining, extending console. include recommendations , pinecone. exciting, ! | ; designing website & user interactions proficiency | , , mockups user proficiency nod"
ai,asaniczka_9cfb08477f2825c7,kaggle_asaniczka,2024-01,Selby Jennings,,", designing implementing , spanning code. encourages delving internals open-source capabilities. emphasizes , researchers, , gain practice. : | * maintain large-scale * * functionality open-source * , researchers, * deepen qualifications: |"
ai,asaniczka_cdae132709cc81e8,kaggle_asaniczka,2024-01,Lirio,agent,"summary , , models/agents makes framework. platform. duties | ’ ( %) customizations state-of-the-art ( ) reinforcement ( ) algorithms ’ requirements ( %) experiments feasibility prototypes ( %) , retrieve, manipulate ( %) algorithms ( %) mo"
ai,asaniczka_91ab9a52caa945d1,kaggle_asaniczka,2024-01,ManTech,,"include, : | , , , ( ) environment. , coordinate, platform. configuration functionality systems. , , , servers, workstations, (lustre, ) maintain backup capabilities systems. maintain procedures, , instructions. , , maintain ( tensorflow, p"
ai,arshkon_3895251457,kaggle_arshkon,2024-04,NAVEX,,"summary: designing , embracing delivering line. , , , amazingly , balancing priorities. : production-ready codemaintain refine librarycreate membersoptimize scalabilityresearch , , used problemsprovide mentorship membersparticipate , , mana"
ai,asaniczka_a87670ccc49b2db0,kaggle_asaniczka,2024-01,DApp360 Workforce,fine_tuning,": | aws; terraform/terragrunt; kubernetes, argocd; ; actions; : | maintain nodes efficiently nodes understand blockchain-specific fine-tuning troubleshooting, , increase eliminate qualifications bring | 3+ experience. , worked , ci/cd. reli"
ai,asaniczka_5e901338ace0aa6e,kaggle_asaniczka,2024-01,Luxoft USA Inc,,"roject : sets , pipelining etl sets. used sets manipulation. require development. minimal direction. requires coordinate systems. : include ( ) sets. c++ (i.e. ) requires , solutioning problems communicating effectively. mandatory : > ( ) f"
ai,asaniczka_f4d54ff7d77c5e20,kaggle_asaniczka,2024-01,LyondellBasell,,"& | emphasis delivering , , , collaboratively , , smes ( , , , ) providing workflows delivering problems collaboratively , , , , exception , , adhered necessary algorithm ml domains including , , preventing downtime, , forecasting, , , , ex"
ai,asaniczka_cb3bac76d7cec31e,kaggle_asaniczka,2024-01,PlanHub,,"& , requires full-stack , , , javascript, , html, xml, xslt, json, third-party , , , databases angular, laravel, , jquery, , , mysql aws cloud. tasks include , prototyping , re-architecting functionality address , , , , , , code. | end-to-e"
ai,asaniczka_8a0fe00dd9d04ed5,kaggle_asaniczka,2024-01,Algo Capital Group,,"c++/python , implementing algorithms strategies. researchers, , industry. : | , , maintain algorithms c++ python. closely researchers understand requirements translate high-performance real-time systems. identify cutting-edge improve strate"
ai,asaniczka_bd2aafd692e55cef,kaggle_asaniczka,2024-01,Lawrence Harvey,,"ai : | high-performing (convolutional ) models. defining requirements, , labeling product. tunning hyper-parameters performance. improve ai/ml finding improve , deployment. , experimentation, , , verification/validation, ai/ml field. ai : |"
ai,asaniczka_806bdf14a6d10d2a,kaggle_asaniczka,2024-01,NuTechs,fine_tuning,"self-starter ( , , , ) focused. important us. ( ) maintaining virtualized servers azure. servers. additional include backups patching , servers desktop/laptop computers. , duties windows-based user , , , backing desk. (rmm) , currently mana"
ai,arshkon_3887907452,kaggle_arshkon,2024-04,"Niantic, Inc.",,"’ seeks researchers user generative ai capabilities , geo-based, productionizing models. capabilities platforms. maintain generative ai models.develop workflows.optimize utilization minimize latency inference.implement maintain alerting ai "
ai,arshkon_3905654103,kaggle_arshkon,2024-04,Teladoc Health,,"red-hot enjoy expertise ’ trailblazing , fascinating approaches ml happiness members. currently ’ approaches lstms, vaes, doc2vec, bandits, reinforcement learning. , behavior-change , reducing costs. , personalize updates recommendations, c"
ai,asaniczka_4dd7d68d8ca3d8e0,kaggle_asaniczka,2024-01,RemoteWorker US,llm,", ai maintain sdks , fine-tune, ai scale. : | world-class ai researchers api services. , , well-managed sdks large-language (llms) proprietary ( ) , real-time , , , governance automation. application-specific llms experience. users ai capab"
ai,asaniczka_d0aafdb4246a9f61,kaggle_asaniczka,2024-01,Vantage Point Consulting Inc.,,"team. , , maintaining applications. cross-functional , , data-driven requirements. : | - , , maintain data-driven language. - cross-functional data-driven - , , well-documented code. - debug functionality. - participate feedback. - etl work"
ai,arshkon_3904060936,kaggle_arshkon,2024-04,QBE Insurance,fine_tuning,"expertise ' , including , , leveraging ai , , leadership. additionally, demands problem-solving, mentorship, organization. , , , ensuring ' tech-driven closely specifications, actionable , , performance. , , , adherence practices. deploymen"
ai,asaniczka_50ca8838aef189e8,kaggle_asaniczka,2024-01,City of New York,,"asks, including mandates, requirements, , maintaining , , promote , accessibility citizens. provides necessary productivity-enhancing ( ), ’ interdisciplinary boroughs, including , , , management. comprised , , , , , , , management. maintai"
ai,asaniczka_631c5b8e2af28bdd,kaggle_asaniczka,2024-01,ExamRoom.AI®,,": , , ensuring compatibility harnessing scratch. recommendation text. webcam understand emotions. ml psychometric scratch. ai/ml identify datasets required. efficiently communicate understand ai/ml , timeline. minimal guidance/training. upd"
ai,linkedin_li-4382987680,scraped,2026-03,Evolv Technology,,"ai/machine ai technology. ai/ml , state-of-the-art involve leveraging , including , , multi-sensor operate real-time constrained platforms. hands-on requires expertise ml, , , , mlops. , robustness, real-world environments. measurably — the"
ai,linkedin_li-4392374886,scraped,2026-03,TrendAI,"llm, claude","** summary** | ** backend ** high-impact next-generation customers. , ’ operate —designing , backend , cloud-native real-world cases. ’ closely , , , high-quality —ranging implementations. hands-on influences adopted, , field. ’ full-stack "
ai,linkedin_li-4355935647,scraped,2026-04,Internet Brands,"llm, agent, claude",": generative ai, ai, engineering. ai , designing prompt-driven workflows, integrating llms, ai : | \& * ai-powered llms (e.g., , claude, , ) engineering. * customize ai , adk, claude * utilize observability , langfuse. * translate requireme"
ai,linkedin_li-4371949658,scraped,2026-03,AMD,llm,"fellow/sr. team. excited gpus, innovating generating , you. * gpus scale. * improve end-to-end gpu cluster. * improve end-to-end debuggability gpu cluster. * out. * contribute source. * up-to-date algorithms/frameworks. * ai platform. * sta"
ai,linkedin_li-4391652565,scraped,2026-03,Veridic Solutions,llm,"* \ * backend c# * proficiency javascript typescript * ‑ ai , llm‑ , * integrating , * , , ** qualifications** | * ‑ * familiarity , guardrails, ai observability * ai regulated ‑sensitive domains"
ai,linkedin_li-4388599860,scraped,2026-03,BJAK,llm,"ai carries , , time. backend , ai, inference ai product. sits users, latency, correctness, , real-world experience. operate capability , , observable used clients. * operate backend ai-powered production. * inference , layers, boundaries mo"
ai,linkedin_li-4394633902,scraped,2026-04,Dover Networks LLC,claude,"requires secret/sci : $256k-$280k additional $64k-$70k immediately vested ( ) contributions : fast-moving microservice ecosystem. development. , encouraged design. closely interacting ui development. * maintain microservices. * closely road"
ai,linkedin_li-4387988026,scraped,2026-03,Jobright.ai,"langchain, langgraph",": | ** ** * maintain ai — runtime * bring ai-driven * , ensuring , , compatibility * real-time inference, , human-ai * contribute , sdks, **qualifications** | * 5-10 backend ai-related * go, async , microservices, api * : , kafka, grpc, web"
ai,linkedin_li-4381904866,scraped,2026-03,Skechers,llm,"\& genai gain hands-on genai learning-first , ai, eager real-world environment. alongside , contribute , cloud-native ai-powered developed scale. ** ' ** | * , including user backend services. * backend engineers. * contribute genai , chatb"
ai,linkedin_li-4390299009,scraped,2026-03,Programmers.io,"llm, llamaindex","** ai ** ** : ai ** **requirements :** | * \ experience. * , oop, * proficiency (fastapi, pydantic, pytorch, huggingface) * microservices, event-driven , cloud-native (rest/graphql) * hands-on ai/llm-based , ( , llamaindex), databases. * fa"
ai,linkedin_li-4395861590,scraped,2026-04,The Phoenix Group,"llm, agent, claude","** ** \& * cloud-based / architectures (e.g., ) * ingestion ( , , , databases) * unstructured ingestion workflows , , etl , serverless (e.g., aws ) * establish governance, cataloging, , generative ai \& llm * retrieval-augmented ( ) dataset"
ai,linkedin_li-4389588977,scraped,2026-03,PANDESCO,llm,", hands-on , mentor. managerial — designing setting , onshore , client-facing utility-knife : confidently , , (c#) , sql, ai capabilities applications. end-to-end, cleanly , cross-functional onshore , , ** ** ** \& ** - , multi-tenant on-pr"
ai,linkedin_li-4393922661,scraped,2026-04,Themesoft Inc.,"llm, agent, langgraph","hands-on , ai/ml , generative ai including , langgraph, retrieval-augmented ( ), designing implementing ai workflows multi-agent * architecting production-grade ai (gpt-4o), , serverless paradigms * designing , fastapi, , langgraph, (gpt-4o"
ai,linkedin_li-4388989494,scraped,2026-03,Aristle AI,llm,"**founding ** **designing v1 ( )** execution : | * backend ( , , , tracking, ) * , governance * (backend, , ) * ** → ** * \ shipped code/services/sdk. * ( , fastapi, node.js, javascript, postgres, db similar) * * llms, , ai ( , , ) * early-"
ai,linkedin_li-4391170279,scraped,2026-03,Talent Groups,,"ai ** summary** ai ai ml , systems. sits , enabling ai workflows, , consistency teams. tuning role. ai improve ai operated. ** ** * ai ml * maintain workflows * ai * establish including templates * ai including , , * workflows temporal.io *"
ai,linkedin_li-4308513056,scraped,2026-03,Adobe,fine_tuning,"** ** * generative ai , , , , , , quickly reliably customers. * prototypes capabilities invented teams. * , , maintain backend , , pipelines. * , , applications. * improve prototypes empathetically listening feedback colleagues. * prototype"
ai,linkedin_li-4393031854,scraped,2026-04,Cynet Systems,claude,| **backend ** ** : backend ** ** : ** ** :** | * maintain backend boot. * maintain restful angularjs. * querying * contribute cicd deployments. * following practices. * troubleshoot * crossfunctional including qa managers. * participate ad
ai,linkedin_li-4383800059,scraped,2026-04,Connecticut Innovations,"llm, agent","** \| ** volume, , underlying , requires , , queries scattered pipelines. , — end-to-end designing, documenting, implementing next-generation arccos. near-greenfield , rethinking ingestion, , , governance, entire , , enabling , , dramatical"
ai,linkedin_li-4377894010,scraped,2026-03,Baseten,llm,"** ** ? ml team. thrives fast-paced eager contributions exciting llm inference. backend thrives excited open-source ml , application. **example ** | ' types : * embeddings inference: embeddings available * inference * ** ** * , refine, prod"
ai,linkedin_li-4355630091,scraped,2026-03,The RealReal,claude,"' , personalization, initiatives. , decides implements them. etl streaming/event pipelines. , , personalization website. , adding , , ensuring correctly. * services. * , requirements * , establishing * , considering , maintainability * , * "
ai,linkedin_li-4388541859,scraped,2026-03,Carlin Shayn Inc,,"** :** | full-stack \</\>\<\> ** :** | (pay-as-you-go)\</\>\<\> ** :** | , :00 – :00 \</\>\<\> \</\>\<\> full-stack high-visibility projects. requires hands-on expertise , , platforms. contribute designing, , delivering , high-quality exper"
ai,linkedin_li-4377024305,scraped,2026-03,athenahealth,llm,", , microservices systems. teams. , , , microservices event-driven hexagonal architectures. , detailed specifications cross-functional —including , , — cycles. ensuring , , maintain , minimal maintenance. organizations. taking deliverables,"
ai,linkedin_li-4394677388,scraped,2026-04,Optum,,"| ** ** hands-on expertise , , angular, cloud-native architectures, , azure. high-performing , contribute , , including ai/ml-driven capabilities ** ** * object-oriented industry-recommended robust * large-scale enterprise-wide * cloud-nati"
ai,linkedin_li-4394399817,scraped,2026-04,Wells Fargo,"llm, agent, langgraph","( ) fundamentals ai focuses designing next-generation leveraging capabilities, including , , agent-based architectures. hands-on , ai/ml , , prototypes, delivering systems. requires , , contribute initiatives. **** , :**** | * agile/scrum *"
ai,linkedin_li-4394960985,scraped,2026-04,Trimble Inc.,llm,"** : (ai \& )** ai-augmented model. , contribute implementing ai workflows delivering next-generation industry. , ai-augmented , gaining hands-on ai workflows automate reduce , ensuring continues sector. ** exciting ** * implementing ai wor"
scope,asaniczka_efb74321d9f5cff5,kaggle_asaniczka,2024-01,Aumni,cross_functional,"| senior-level javascript utilizing node express. , expected well-architected maintainable, consistent, readable developers. , linters, , reviews. | 5+ javascript (preferably node.js express.js) methodologies ( 2-week sprints) object-orient"
scope,asaniczka_f7619b7e9a840db8,kaggle_asaniczka,2024-01,"TalentBurst, an Inc 5000 company",end_to_end,"| duration: 6+ summary: | , , (e.g. - ) requirements. : analyze requirements; specifications applications. , , efforts. , , solution. assure , requirements area. evolving environment. quickly adjust accordingly manner. : | needed ( ) sql sq"
scope,arshkon_3901903057,kaggle_arshkon,2024-04,TechNumen,cross_functional,"10+ experience. : % remotetop havesazure , hosting, databases, , ais10 , sre/devopsneed skills. :- , maintain available, , azure-based systems- , , , , , ai services- , maintain ci/cd applications- azure-based , including iam, , protection-"
scope,arshkon_3905240305,kaggle_arshkon,2024-04,SHEIN Technology LLC,cross_functional,": ireports : engineeringjob : , , usajob : exempt, summarywe - ( : ) , ca-based hub. software/systems , overarching "" on."" planet. sres closely cross-functional , collect, analyze, visualize , exactly happens problems occur address quickly "
scope,asaniczka_ad87c562339cbf85,kaggle_asaniczka,2024-01,Grifols,cross_functional,"r& team. , systems. r& shall , cross-functional nucleic acid in-vitro (ivd) systems. cross-functional involving , , reagents, disposables. subsystem sub-systems , robustly , requirements. , ' systems/subsystems , , , requirements management"
scope,asaniczka_6e8855f5dfdb4e9d,kaggle_asaniczka,2024-01,KQED,"cross_functional, roadmap","back-end applications. generally constructing microservices, delivering mission. : | architectures , cloud-based , maintain high-quality (including microservices) javascript/node.js, php/wordpress, boot. cross-functional , , functionality a"
scope,arshkon_3903840737,kaggle_arshkon,2024-04,Viasat,autonomous,"' providing users in-flight in-flight day. maintaining existing , , , installers. day-to-day , , venue-side gem. ( ) encompasses services. , : recognized ( ) arearoutinely resolves needswork instructioncontribute productsdevelop briefingsty"
scope,arshkon_3904950473,kaggle_arshkon,2024-04,ICE,cross_functional,"| (ui) ui functionality applications. (ui) , , modules ’ tier. effectively cross-functional , qa, , facilitate process. maintain consistent ui/ux applications. , exercising estimation, , deployment.collaborate cross-functional , qa, , facil"
scope,asaniczka_2337f6bebbabb68f,kaggle_asaniczka,2024-01,ScaleneWorks INC,cross_functional,"takes providing contributing team. , increase , , efficiencies , , high-quality engineering. project-related , , , data-oriented organization. | cross-functional closely , , industry-standard continuously improve , , query tuning user , , m"
scope,arshkon_3884836571,kaggle_arshkon,2024-04,Cloudbeds,cross_functional,"reservation manages guests, , arrivals departures, identifying overbookings, reservations. flows, you. , architectures, , platform. contribute service-oriented architectures, leveraging , , , , mind. alongside , , (aws) layers stack. cross-"
scope,arshkon_3904953091,kaggle_arshkon,2024-04,The Depository Trust & Clearing Corporation,"end_to_end, cross_functional","- - : ui / ux specializes , designing, , user user , , , firm. provides user , usability, , expertise , including , , user , , elements. performs proposed feasibility, existing architectures , desired user standards. : needed considering , "
scope,arshkon_3905365406,kaggle_arshkon,2024-04,NextEra Energy Resources,cross_functional,", operationalize program.you applying expertise industry-leading , , , facilitating , , homeowners.in expertise, effectively team.you comfortable methodologies. , , improve , , , , projectscollaborate cross-functional , including , , , requ"
scope,asaniczka_2a2f935ab876000c,kaggle_asaniczka,2024-01,CACI International Inc,cross_functional,"minimum : ts/sci polygraph percentage : % : currently team. , contributing , , java-based applications. | robust roadmaps cross-functional , including , , mid-level , fostering maintain , , maintainability investigate , identifying understa"
scope,arshkon_3906253333,kaggle_arshkon,2024-04,Madhive,cross_functional,", contribute implementing algorithms improve services. , ’ affinities, , goals. ’ : , , algorithms , including bidding , & retrieval functionalities, user enhancements.work closely preprocess , ensuring training.identify accuracy.develop ro"
scope,arshkon_3904724182,kaggle_arshkon,2024-04,Google,cross_functional,"minimum qualifications: bachelor' experience.8 , structures/algorithms.7 security.5 ; testing/launching products. qualifications: ’ , , field.5 setting direction.3 , matrixed involving cross-functional, and/or cross-business projects. (gcp)"
scope,asaniczka_36f6d9c1b429a903,kaggle_asaniczka,2024-01,Penske Truck Leasing,cross_functional,": | – tririga team. , business-critical application. contribute customers. , , fast-paced collaborating topics maintaining modernizing existing ensuring requirements : | , addressing promptly entire , including , , , ongoing well-documented"
scope,asaniczka_0fb7e9a947d82a4e,kaggle_asaniczka,2024-01,RevStar,cross_functional,"seniority: mid-sr. us-based full-stack js ! experince , documenting , identifing followed. haves | team-focused desire fast-moving start-up self-driven self-motivated voracious learner; constantly challenging solver desire adaptable , disci"
scope,asaniczka_06c367b9941226c8,kaggle_asaniczka,2024-01,Pietra,end_to_end,", closely , ux , high-quality pace. domains: , , first-party showcases , used together. embody product-minded experimentative , week. 4+ high-quality quickly. encourage opinionated ui & products. ’ : | producing consistent high-quality | id"
scope,asaniczka_0190eea8624b5c38,kaggle_asaniczka,2024-01,Public Storage,cross_functional,"engages , , , , , including specialization consumer-facing , front-end development. | participates , , , , tools. problems; go-to ui participate brainstorming determine develops/designs establishes cross-functional expected qualifications |"
scope,asaniczka_82987b104892961e,kaggle_asaniczka,2024-01,ExLabs,"end_to_end, cross_functional",", overseeing end-to-end , requirements , , maintenance. expertise ensuring , , : | provides expertise teams. / requirements , requirements decomposition assignment requirements manages traceability requirements specifications derived requir"
scope,asaniczka_12e76ac3f7298951,kaggle_asaniczka,2024-01,Sierra Nevada Corporation,cross_functional,"! , expertise , , , simulate, , certify improve services. ' architectures , ushering preliminary detailed , , tools. cross-functional , system-level lifecycle. must-haves: | programs. bachelor' discipline typically demonstrated tcp/ip | mul"
scope,asaniczka_665b41a713921af9,kaggle_asaniczka,2024-01,PAR Government,cross_functional,", enjoys paced real-time nation. specializes c++, c#, possesses ( ) lifecycle. , real-time , systems. additionally, familiarity xplane bonus. duties: | , , maintain c++, c#, language. cross-functional , , models. software. adherence systems"
scope,asaniczka_46800bb949e74b2b,kaggle_asaniczka,2024-01,Danbury Mission Technologies,cross_functional,"team-based electro-optical ( ) operate environments. depending complexity expected requirements, subcontracted , subassemblies. smaller expected possess requirements , , requirements , , qualification , , documents. establish robust executa"
scope,asaniczka_2667a277c4f57810,kaggle_asaniczka,2024-01,Freeform,autonomous,", architecting implementing factories operate autonomously speeds precision. entails , , systems. effectively nervous factories. , maximizing , maintaining entire team. - , motivated, problems ! : | state-of-the-art production-scale , , , ,"
scope,arshkon_3903824682,kaggle_arshkon,2024-04,Adobe,cross_functional,"' app. cross-functional , ' platform. ’ ; obsess , , , , ’ , next.js, , typescript, graphql codegen, jest, storybook, styled , framer , maintaining iterating best-in-class enables ' scaleshape, , , , user , qa, backend engineersreceive feed"
scope,linkedin_li-4392842232,scraped,2026-04,BEUMER Group,cross_functional,"** ** , , , multifaceted requiring in-depth applications. analyzing requirements, , costs, overseeing layouts 2d delivering proposals. additionally, , collaborates , , software/controls address requirements. participating , expert. ** ** **"
scope,linkedin_li-4390714760,scraped,2026-03,"Trilyon, Inc.",end_to_end,"| ** full-stack ** enjoys | **entire ** — — closely problems. ** :** | * **full-stack ** (backend, , ) * ** , , , ** understand workflows | * identify requests ** / reusable ** * stakeholder , , ** prioritization ** * iterate quickly feedba"
scope,linkedin_li-4383785413,scraped,2026-04,Parsons Corporation,end_to_end,"** , , mission-critical ** ** ' ** * , , written c/c\ \ * maintain documentation (schemas, , versioning ) * participate on-call rotation escalations required. * , , diagnose end-to-end failures environments. * maintain build/deployment ci/c"
scope,linkedin_li-4386502207,scraped,2026-03,OnMed,"cross_functional, roadmap","** ** senior-level designing cloud-first environments. bring expertise , , governance ecosystems. - , , interoperability, systems. comfortable hands-on level. high-growth motivated leveraging healthcare. * , , enterprise-grade services. * ,"
scope,linkedin_li-4339134631,scraped,2026-04,Cisco,end_to_end,"motivated sustaining products. ’ eol. positon, ai solution. provides ongoing (including ) pre-concept life. , ( , ), , problems avoidance fcs. sustaining , improvements. * / sustaining engineering. * manufacturing. * bom structuring bom man"
scope,linkedin_li-4355383085,scraped,2026-03,CoreWeave,roadmap,"** ’ ** coreweave. thousands gpus waiting. ? spent setup research. , , orchestration. came models. , ' operations. problem. ' ' , kubernetes-native , sandbox , possibly altogether. : currently exists labs. ** ** * contribute roadmap trainin"
