category,uid,source,period,company_name_canonical,matched_terms,excerpt
management_broad,asaniczka_c5b8ab17225c9f6f,kaggle_asaniczka,2024-01,SRC Holdings Corporation,coordinate,": remanufacturing. continue customers. : | maintaining , including needed. department. coordinate product/process introduction activities. documenting specifications , disassembly, , processes. technicians applicable. bills-of-material expe"
management_broad,asaniczka_72812686917d2cda,kaggle_asaniczka,2024-01,Katalyst HealthCares & Life Sciences,"team, stakeholder","| evaluate requirements completeness user used evaluating x-ray consistency reduce burden existing testing. algorithms conjunction , functionality existing features. ensures regulations, including qsr. ensures dicom | participate needed rev"
management_broad,asaniczka_8f5dc79863757866,kaggle_asaniczka,2024-01,Nigel Frank International,team,"hands-on designing, , maintaining robust architecting, , ' , ensuring , , qualifications: | bachelor' , , similar role. expertise designing implementing available, , architectures. proficiency aws ( ), networking. hands-on containerization "
management_broad,asaniczka_116c939c8f04e117,kaggle_asaniczka,2024-01,Mativ,"team, coordinate","| identifying bottlenecks eliminate this. capas, | captures performs effectively (qms) & existing identifying & implementing & , communicating tools/materials respective teams. assures modified documents conform establishes system. maintain"
management_broad,asaniczka_737523bcb8b9b1fe,kaggle_asaniczka,2024-01,Arcfield,coordinate,"provides ( ) non-core improve ( ) posture customer. capabilities : , (fisma) , ( ) , , authorization ( & ), vulnerability , | provides tasks include, : recommendations identify ’ requirements recommendations participate ’ coordinate followe"
management_broad,asaniczka_638fd128ef50a177,kaggle_asaniczka,2024-01,The Farmer's Dog,"team, collaborate","' ' ( , , etc..) team. helps (pawds) , maintain , , users self-service platform. enjoy frequently collaborating customers. draw understand , , expertise. end-users quickly, safely, process. believe... | ( passes checks) prod deploy. continu"
management_broad,asaniczka_56f477484d0864fd,kaggle_asaniczka,2024-01,Cohere Technology Group,team,", environment. closely requirements sprint. time. administrator/ , , team. participating discussions establish db consistency efforts. administrator/ following: providing expertise postgresql dbms maintaining , views, , constraints , implem"
management_broad,asaniczka_f0f1c8702f83fe91,kaggle_asaniczka,2024-01,Fladger Associates,team,"inviting ai (llms) team. involves leveraging llm front-end back-end contribute research. llms enthusiastic full-stack development. specifically llm , encompassing front-end back-end aspects. collaboratively cross-functional translate llms. "
management_broad,asaniczka_8c3615169625407a,kaggle_asaniczka,2024-01,Kellton,team,": | ( 2x ) | ** weekdays, rotation nights/weekends** , , establish consistency , reduce promote efficiencies ' objectives. ; deliverable expected , standards/metrics maintained, approaches improve analyze performance. observability seen obs"
management_broad,arshkon_3888011542,kaggle_arshkon,2024-04,Included Health,team,"backend , , way. closely , user , workflows, , applications. excited team.you successfully developers. getting done.you solver utilizing first-principles thinking.you enjoy debate , peers.you , demonstrate ’ work.you maintaining , suggested"
management_broad,asaniczka_6159264b5daa91f4,kaggle_asaniczka,2024-01,Rippling,coordinate,"hris ( ) , consists , , used rippling. hris , end-to-end ( & onboarding flows, ) facilitate ingestion, , , spanning enterprises. ’ next ( & unbundled ) existing ( , & offboarding flows) enterprise. : next hris flows & utmost external. : ( )"
management_broad,asaniczka_593adf731df94933,kaggle_asaniczka,2024-01,Foresight Diagnostics Inc.,team,"’ function. evolves vertically , organization. functionally objectives intention scaling. full-time , require schedules, including , weekends, holidays. operations. bring: | 5+ environments. bachelor’ : ba/bs. , preferred. additional genomi"
management_broad,asaniczka_2ef6b909e6c893fd,kaggle_asaniczka,2024-01,"Itron, Inc.","team, collaborate","firmware , collaboratively fast-paced environment. firmware existing applications. non-embedded ' products. duties participate , specifications , , maintaining needed documentation. firmware teams. experience/qualifications c,c++, c++ | , s"
management_broad,asaniczka_1e3485fee601dd1a,kaggle_asaniczka,2024-01,Intellectt Inc,team,"duration: | | required. execution strategies/techniques, schedules, , , procedures, boundaries management. judgment assess acceptance. teams. requirements, documentation, assess correctness, completeness, testability, usability. performs ma"
management_broad,arshkon_3894869836,kaggle_arshkon,2024-04,Fern (YC W23),team,"’ expect , expect javascript fundamentals next.js, , typescript. user-facing features. polish. refine ui adaptable ’ brands. ’ storybook, improve ci/cd , ' , monitoring. customers. early-stage , growth-stage , understand needs. team. ’ , , "
management_broad,linkedin_li-4389237928,scraped,2026-03,BCforward,team,"** : ** **java/etl)** **duration: c2h** * team. , , aws, , , large-scale datasets. ** \& qualifications:** | * \ experience. * hands-on domain. * proficiency , , stability. * , including , debugging, maintenance. * sql querying manipulation"
management_broad,linkedin_li-4363793342,scraped,2026-03,Nuuly,team,"ios , , swiftui uikit. , crafting reusable millions users daily. , ’ participate pair-programming, , evangelize team. problem-solver accessibility, robust strategies. closely cross-functional releases, ensuring high-quality launch. ** ** io"
management_broad,linkedin_li-4349670207,scraped,2026-03,Medline,team,"* proofs (pocs) , articulate , decision-making. * identify , propose , processes. * , , , practices. * establish processes. * demonstrate expertise ( ) automation. * promote well-architected , ensuring teams. * , , , , standards. * translat"
management_broad,linkedin_li-4389935997,scraped,2026-03,Toyota Research Institute,team,"contribute real-world vehicles. generalist , , , , improve robustness real-time stack. ’ alongside researchers , gaining deepening expertise software. c\ \ , real-world , desire fast-paced, environment. ' closely end-to-end , runs robustly "
management_broad,linkedin_li-4356050495,scraped,2026-04,Q2,"team, coordinate, collaborate","ambitious adaptable ? ’ , collaborating , , cutting-edge clients. self-starters tinkering pushing boundaries fast-paced environment. ** ** | * strictly methodologies. * , , sub-systems seamlessly existing platforms. * requirements manageabl"
management_broad,linkedin_li-4366563674,scraped,2026-04,Klaviyo,"team, collaborate","tackling problems certain , \& obstacle way. operates real-time coded (aws) disciplines. devx – ’ features. examples include: * directory, used promote allow * self-serve submit * api used diagnose understand api usage. – , second. * autoge"
management_broad,linkedin_li-4385836564,scraped,2026-03,Actalent,team,"** : ** ** ** fpga/soc development. involves on-orbit constellations. , representative , cross-team , management. ** ** | * , , subsystem deployment. * maintain modify functionality requirements. * mission-specific microcontroller control. "
management_broad,linkedin_li-4355374272,scraped,2026-03,FanDuel,"team, stakeholder","’ , business. collaboratively , high-quality , timelines, needs. closely exceptionally high-quality , taking , , , maintaining software. lifecycle. improve platforms. larger landscape. go called identify technology. contributor. consistentl"
management_broad,linkedin_li-4368438650,scraped,2026-04,General Atomics,coordinate,"** summary** currently ga-ems department. , execute subsystem validate capabilities hwil (hwil) field. **duties \& responsiblities:** | * requirements documentation * including sequencing, , , inputs validate , subsystem, requirements * set"
management_broad,linkedin_li-4364128914,scraped,2026-03,MetroStar,team,"| ** ai/ml ** , ’ , , , web-based , mission-focused environment. emphasizes ai, experimentation, cross-functional production-ready capabilities change. ** ’ :** | * , , , fine-tune ai web-based evolving cases.. * maintain , workflows, exper"
management_broad,linkedin_li-4376211338,scraped,2026-03,Boeing,coordinate,", , , , continuously improve (qms) mission-critical programs. as9100d , , systemic — , , , embed organization. qms execution roadmap , , qms , initiatives. , , grows manifest. ' currently 1-2\ : | * qms \& * , , execution qms top-level , en"
management_broad,linkedin_li-4397316774,scraped,2026-04,"Stanley Black & Decker, Inc.",team,"\& organization. execution , ’ : | * firmware specifications including brushless , li-ion chargers. * validate , simulation. * procedures tests. * , objectives , , sub-assemblies. * larger team. * maintain documentation performed. * transla"
management_broad,linkedin_li-4370729663,scraped,2026-04,General Dynamics Mission Systems,team,"requires bachelor’ , , , field. requires \ job-related , ' job-related experience. preferred. performed , citizenship required. scottsdale-based team. provides uniquely contested environments. , including restricted customers. , closely all"
management_broad,linkedin_li-4365627497,scraped,2026-03,First Citizens Bank,collaborate,"designing, implementing, optimizing , , collaborating data-driven decision-making. ** ** * - , architectures. objectives. evaluate capabilities * hands-on - real-time processing. flows high-volume, high-velocity environments. etl sources. *"
management_broad,linkedin_li-4389828801,scraped,2026-03,Pop-Up Talent,collaborate,"** \& ** **large-scale location-based ** * involves ** backend ** , contributing , , , monitoring. requires **hands-on ** enjoys problems high-volume ** :** | * maintain ** ** , including: ios \| \| * ** ** * maintain ** ** * ** ** * analyz"
management_broad,linkedin_li-4372794138,scraped,2026-03,Gusto,team,"’ \& ai team. ’ ’ ai/llm , authentication authorization securing data. ’ high-impact problems , , ai-powered quickly safely. \& ai sits , , ai gusto. prioritize ‑ reduce , , teams. , embed needed, authentication, authorization, , especially"
management_broad,linkedin_li-4391763198,scraped,2026-03,Lenmar Consulting Inc,lead,"** ** | – \& - h1b, opt.cpt time. lead-level technologist chops (c\ \ aws - ), also. build/deploy/troubleshoot – dealt layers. – ; dealt problems. ** qualifications:** | * , , urgency, * , javascript/html/css * * , , high-quality * * docume"
management_broad,linkedin_li-4311302487,scraped,2026-03,Teradyne,collaborate,"generative ai? next , chatbots beyond. ’ hands-on cutting-edge ai/ml , collaborating real-world impact. ** , ** * , , end-to-end generative ai ai , * llm-powered , including retrieval-augmented ( ) * : , robust , , documentation * curve eva"
management_broad,linkedin_li-4394312604,scraped,2026-04,General Atomics Aeronautical Systems,team,"ga-asi, , , and/or modify enterprise-wide –user, , correlate ( ) **duties \& :** | * c\ \ x86 systems. * petalinux * , , , documentation standards. * evaluate environment. * communicate , users, lifecycle. * contribute deployment. * maintai"
management_broad,linkedin_li-4359480401,scraped,2026-04,Deutsche Bank,team,"** ** ( ) , contribute , , , , bank. closely , , high-quality, cloud-enabled ’ | * , , , high-quality , end-to-end * maintain backend , , java-based , including microservices, , event-driven * ci/cd , , releases * , maintainable, testable ,"
management_broad,linkedin_li-4383785413,scraped,2026-04,Parsons Corporation,"team, collaborate","** , , mission-critical ** ** ' ** * , , written c/c\ \ * maintain documentation (schemas, , versioning ) * participate on-call rotation escalations required. * , , diagnose end-to-end failures environments. * maintain build/deployment ci/c"
management_broad,linkedin_li-4386547769,scraped,2026-03,Talently,team,"** :** | , qualification, , , characterization ** :** | * , , , including recommendations dfq. * characterization teams. * characterize , , ( ) setups, limits. * failure. * qualification, , execute qualification activities. * introduction, "
management_broad,linkedin_li-4383251142,scraped,2026-04,ViaPath Technologies,team,", disciplined team. recent , , simultaneously ; problem-solving creatively. platform. ** ** | * (including ) architecture/design * contribute object-oriented * requirements closely documentation * qa thoroughly evaluated released. code. * u"
management_broad,linkedin_li-4375661013,scraped,2026-04,Raytheon,stakeholder,"| ** , , requirements:** transferable issued date. citizenship , eligible ** :** | : ** :** | obtain issued ** ** capabilities ( ) discipline, ltamds. bring , requiring disciplines troubleshoot , , contributions mission-critical , ' hands-o"
management_broad,linkedin_li-4393472774,scraped,2026-04,Visa,"team, collaborate","’ problems flows, , , b2c ’ problems flows, , , b2c platforms. , , scale. , multi-functional inventing, designing, , base. , transactions. : | * % influencing ’ , , reusability * multi-functionally artifacts best-in-class offerings * contri"
