category,uid,source,period,company_name_canonical,matched_terms,excerpt
scope,linkedin_li-4391253123,scraped,2026-03,Gainwell Technologies,cross_functional,"**summary** designing, , maintaining ? organization. ? ? , requiring expertise , , , aws, emphasizes , , governance, independently ? ? * : , , maintain etl/elt workflows , , python. * \& : , , , , governed analytics. * workflows: improve , "
scope,linkedin_li-4367675862,scraped,2026-04,Groundworks,cross_functional,"| ** ** designing, , maintaining high-quality ’ goals. requires , collaborating cross-functional translate requirements , , products. contribute ’ capabilities. **duties ** * , , , maintain user existing * contribute , ensuring , , performa"
scope,linkedin_li-4387772292,scraped,2026-03,Tradeweb,roadmap,", , self-motivated ' next-generation 24/7 platform. cloud-based c\ \ microservices orchestrate counterparties, , ledgers. remote. used efforts. occasional off-sites. | * c\ \ cloud-based microservices * participate ; contribute roadmap * to"
scope,linkedin_li-4338713203,scraped,2026-04,Roku,end_to_end,"’ , , actionable everyone. operate data-driven , self-service dashboards governed, high-scale platforms. end-to-end : , tableau , thoughtfully quickly understand ’ happening next. , tableau capabilities. ’ tableau aws gcp, migrations, , gov"
scope,linkedin_li-4345215691,scraped,2026-04,Form Energy,"cross_functional, roadmap","improve iron-air packs systems.this , ca. , * * subsystems. exciting fast-moving ! * : (dfr) subsystems iron-air , cross-functional failure (dfmeas) * translate high-level rigorous requirements. roadmap validate lifetimes. * experiments fai"
scope,linkedin_li-4392807096,scraped,2026-04,B4Corp,end_to_end,": : – : 9am ** ** | requires (ts/sci) polygraph. ** ** – \& flows application. , familiarity , , , governance demonstrated etl workflows scale. : * end-to-end leveraging , including configuring updating * containerizing aws. * mysql postgre"
scope,linkedin_li-4391916807,scraped,2026-03,Fourways Consulting Services,end_to_end,** :** | ** ( )** ** \& ’ :** ** (must-have):** | * backend / ( ) * end-to-end * sql / ** / :** | * (current/future ) * edw ( ) * datastage (etl) * sql-based ** :** | * lead-level / * end-to-end * full-stack capability ( \ ) * backend \> ( 
scope,linkedin_li-4391643107,scraped,2026-03,ImpetusIT,cross_functional,", , maintain high-performance applications. ** :** | * , , maintain applications. * cross-functional , , features. * well-designed, , reusable code. * troubleshoot debug optimization. * , , automation. * 2-5 , c\ \ , frameworks. * databases"
scope,linkedin_li-4387994445,scraped,2026-03,Apple,"cross_functional, roadmap",", revolution. , important foundational ’ , , dictation, captioning accessibility third-party apps. next-generation speech-to-text apis. , , , design. cutting-edge ml generative ai capabilities , , developer-friendly apis. requiring effectiv"
scope,linkedin_li-4390060002,scraped,2026-03,"MWResource, Inc.",cross_functional,"**duration:** | motivated expertise contractual basis. , designing, , maintaining applications. cross-functional high-quality ' needs. ( ), particularly integrating ecosystems. ** ** * maintain * , , functionality user * , maintainable, * f"
scope,linkedin_li-4261009009,scraped,2026-03,Masimo,cross_functional,", ai \& ml r\& next-generation , non-invasive , , facilitate next-generation devices. analyzing conditions diagnosis, prediction events. include streams non-invasive , speech/audio image/video. , ai \& ml closely , products. **duties \& ** "
scope,linkedin_li-4392669684,scraped,2026-03,MARVEL Infotech Inc.,end_to_end,"** : ai/ml ** ** ** ** ** | * (ai/ml, , aws, genai) * end-to-end ai/ml generative ai , including , , , deployment. * maintain ‑ aws , ecs/fargate, , api , dynamodb, rds/aurora, sagemaker, bedrock. * ‑ microservices (fastapi/flask) enabling "
scope,linkedin_li-4356497128,scraped,2026-04,Safran,cross_functional,", , robust electro-mechanical systems. possess , proficiency , electro-mechanical principles. existing developed next aircraft. duties entire , requirements , manufacture originate specifications, documents, verification/validation procedur"
scope,linkedin_li-4305681873,scraped,2026-04,Versa Networks,cross_functional,"** summary** full-stack ' team. customer-driven , data-rich, portals , , platform. requires cross-functional including , , geographies troubleshoot , proof-of-concepts, needed. ** ** | * sd-wan, sse, sase * combining (e.g., backbone.js) (e."
scope,linkedin_li-4365536687,scraped,2026-04,Talent Stack,end_to_end,"** :** | \& transferable ts/sci ( polygraph ) ( accept ts) | ** ** mission-critical customer. , evaluate , , baselines. * troubleshooting, , documentation applications. * troubleshoot isolate errors unexpected performance. * execute , , bas"
scope,linkedin_li-4288469747,scraped,2026-03,Spotify,cross_functional,"recommender generative recommenders foundational personalization formats. closely cross-functional execute , next user representations , paradigms, , filtering storage. ' | * contribute defining generative recommenders foundational user * s"
scope,linkedin_li-4386496705,scraped,2026-03,Waters Corporation,"end_to_end, cross_functional","| ** ( )** broader excellence. designing delivering ** , , ai-enabled ** measurable improvements. hands-on, , maintain ** , , ** scorecards, kpis, okrs, (e.g., ) closely , , , translate robust, future-ready ** ** | * cross-functional transl"
scope,linkedin_li-4390854599,scraped,2026-03,Nexus Spark Group,cross_functional,"designing, implementing, maintaining robust etl processes. additional include optimizing , orchestrating large-scale , collaborating cross-functional data-driven decision-making. involves identifying improve , ensuring systems. **qualificat"
scope,linkedin_li-4374145287,scraped,2026-04,Saronic Technologies,"end_to_end, cross_functional","** ** \& , , systems. sits , , , , friction-heavy , , experiences. throughput, , , — queuing circulation wayfinding, , rhythms. , users indispensable business. ** ** * ’ | * end-to-end ( , , campuses, , nodes, ) * queuing ( ) perceived wait"
management_strong,asaniczka_dc0908d9abe4b798,kaggle_asaniczka,2024-01,Camaco-Amvian,supervise,", improve existing products. generally, following duties independently minimal management. generally , sub-assemblies systems. assignments include , introduction procedures (caapd) coordinate designated including, , , procedures (caapd) ( )"
management_strong,asaniczka_d7a777eeda4836d5,kaggle_asaniczka,2024-01,recruitAbility,supervise,"continue exponentially , ( ) positions – developmen , completing assignments improved and/or processes. assess feasibility soundness proposed implementations, minimum , coordinate objectives. go : | documentation, including diagrams, descri"
management_strong,asaniczka_376bd7419ba2b6ac,kaggle_asaniczka,2024-01,"American Energy Storage Innovations, Inc.",supervise,", % % management. , , , coordinate, firmware , , innovation. objectives attainment. measured efficiently implementing delivering cost-effective | attract, , retain talent. team. , , ’ establish firmware / team. supervise overseeing needs. c"
management_strong,arshkon_3901990442,kaggle_arshkon,2024-04,Microsoft,hire,"(cxp) , designing increasing reliability. | , , , high-performance include: : , , , maintain customers. : swes demonstrate , ‘go ,’ quickly , estimate past innovation. : , co-create competent written & skills. : understands result value. : "
management_strong,arshkon_3904423079,kaggle_arshkon,2024-04,Equifax,supervise,"’ demonstrate , architectures problems including , demonstrate problems deeper needed include , , , scrum troubleshooting gcp aws , , data/metrics maniacal optimizing efx maintaining , devsec, kpis , maintain , slo, slis efx , , , , up-to-d"
management_strong,asaniczka_d116de58e86f000a,kaggle_asaniczka,2024-01,Judge Group,hire,": locations : , ( needed) duration: hire/fte needed: | minimum combination - bachelor' science/engineering. , documentation, withstand demanding base. real-time c, c++, linux. experience. : , , c+ dispense applications. existing basis. , sp"
management_strong,arshkon_3901941925,kaggle_arshkon,2024-04,RiverPoint Group,manage,"duties | - participation user interviews understand needs. - website foundry. - designing user interactions workshop. - back-end semantic (ontologies) , workbook, ontology manager. - servers, databases, datasets functionality needed. - ensu"
management_strong,arshkon_3903886475,kaggle_arshkon,2024-04,Jobot,hire,"well-known, , , , , well-versed software. direct-hire cutting-edge prototypes simulator implementing. , , , , , documentation simulator model. , , , , simulator modelscreate, maintain, plansdevelop qualification documentation validate model"
management_strong,arshkon_3902832523,kaggle_arshkon,2024-04,"Zillion Technologies, Inc.",mentor,": ai engineerlocation: – areaopen : genai , designing, , cutting-edge ai growth. closely cross-functional identify leveraging problems services. : ai-driven , algorithms, models.conduct state-of-the-art improve , , scalability.collaborate ,"
management_strong,arshkon_3901357763,kaggle_arshkon,2024-04,Cherokee Federal,mentor,"existing proposed improve organization. projects. independently cfed objectives. day-to-day , ongoing growth. defines documents regarding maintenance. provides , , mentorship competencies. completes services. architectures utilize practices"
management_strong,asaniczka_30b10844f352789b,kaggle_asaniczka,2024-01,"MS Technology, Inc.",manage,", , documenting requirements, , projections evolving , including smrs, microreactors , , enacting model-based (mbse) , formulation detailed design. | high-level requirements proposed projects. facilitate high-level requirements traceable , "
management_strong,asaniczka_5ae8ea96f15225e7,kaggle_asaniczka,2024-01,Leidos,manage,", , , , user (ama-024) | (timecard approval, , ~ % ) , , maintain , websites, portals. user : html, , javascript, bootstrap, , react. server-side c#, , node.js. schemas, , performance. detailed explanations , used, api documentation, standa"
management_strong,asaniczka_f9117c2304404fa5,kaggle_asaniczka,2024-01,MassMutual,mentor,"located. , team. : | data. enjoy collaborating understand needs. you. communicator. objectives : | , , maintain business. translate requirements specifications. ingest warehouse. cleanse maintaining controls. existing , leadership. ' : | pr"
management_strong,arshkon_3903451435,kaggle_arshkon,2024-04,SPAR Information Systems LLC,supervise,"role/title – developerlocation – , duration – 12+ contractcontract-w2 skills/experience 8+ developmentrequired software/technology , angular, , microservicesdescription: , documentation cross-functional, multi-platform systems. s/he analyze"
management_strong,asaniczka_93674ba59c54be6f,kaggle_asaniczka,2024-01,Onto Innovation,manage,"summary & | engineer/technical -gm ' , occasional (~ %) , primarily, , malaysia. | - , include lithography stepper – duties | coordinate managers. performs , independently observe study. demonstrate capabilities detecting defects optimizing"
management_strong,asaniczka_04d1f85bf9aef432,kaggle_asaniczka,2024-01,TEK NINJAS,mentor,", , , , web-based full-stack environment. , high-performance, , user-friendly include , , conceptualizing applications. provides , users, closely mentor."
management_strong,asaniczka_8bfbdb3098bfe4d4,kaggle_asaniczka,2024-01,GForce Life Sciences,supervise,"12+ possessing combination , , experience. setups, protocols characterize low-power modules, , boards. documenting reports. r& , , , , necessary minimal supervision."
management_strong,arshkon_3905331672,kaggle_arshkon,2024-04,"BAE Systems, Inc.",supervise,", self-motivated multi-disciplinary , fast-paced environment. back-end mission-focused couple applications. tasks include , (conops), , baselines, documentation including user , , , objectives. tasks include , , , , , , validation. addition"
management_strong,asaniczka_3c2affcd6ff21491,kaggle_asaniczka,2024-01,Lennar,manage,"manager. , directing , , , , debugging. hands-on expected configuring, , , implementing lennar. include closely user experiences. , expected skillsets engineers. duties | recognized , expertise. influences expertise improve expertise. devel"
management_strong,asaniczka_74cb33d9410de9fc,kaggle_asaniczka,2024-01,CDW,"manage, supervise","offerings. necessary breadth providing , including , clients. ------- ------- | , , needs. , hardware/software problems. understand offerings outlined descriptions understand procedures mans procedures manual (sop) detailed concisely articu"
management_strong,arshkon_3902736535,kaggle_arshkon,2024-04,Fidelity Investments,mentor,"’ , angular ngrx rxjs hibernate jpa. , next evolution. require hands-on , , co-located , visualize change. expertise bring bachelor' ’ , ! 8+ architecting, designing, , maintaining multi-tier applications2+ demonstrated experienceexemplary "
management_strong,arshkon_3906097174,kaggle_arshkon,2024-04,"Two Point Conversions, Inc.",supervise,"responsibilitiescollaborates client-facing evaluate requirements according (e.g. , , ) performs , , troubleshooting according specifications cost-effective manner.maintains documents , wikis, bases. tracking documenting use.participates for"
management_strong,asaniczka_792e52eab3a4cae0,kaggle_asaniczka,2024-01,Zel Technologies LLC,supervise,"summary clients. applicant setting , , testers, engineers. : | , , , devsecops. , determine architectures, , teams. engineers/developers. scrum team. involving languages. , , containerization, integration. virtually , refine, explain requir"
management_strong,asaniczka_7edbcfca41940724,kaggle_asaniczka,2024-01,Acclaim Technical Services,supervise,"| ts/sci polygraph , virginia. , , , , debug , existing software. | analyze, services. environment. ongoing , existing platforms. cross-functionally , , engineers. troubleshoots problems provides issues. recommendations improvement. alongsi"
management_strong,arshkon_3906251552,kaggle_arshkon,2024-04,"Matson, Inc.",manage,", , existing units. aws ensuring managers. , requirements enhancements. , (s.n.o.w) applications. matson. ’ expertise , , units.demonstrate , , sql.analyze understand problems/requirements solutions.translate requirements documents team.eff"
management_strong,linkedin_li-4397373417,scraped,2026-04,Net2Source (N2S),manage,"** :** | * ( ) ** :** | * create/manage etl ; automate analysis/aggregation * : , aws, etl, , control-m, airflow, pyspark, * pyspark, control- etl"
management_strong,linkedin_li-4348413829,scraped,2026-03,Walmart,mentor,"conversational ai designing, , robust genai emphasizes , , , ensuring impact. end-user next-generation conversational ai , interactions platform. : * abreast processes. * , fostering innovation. * hands-on prototyping, researching, , consum"
management_strong,linkedin_li-4204408735,scraped,2026-04,Plaid,mentor,"** ** | * \& : maintain backend , scalability. * : closely needs. * : , maintainable code. * \& debugging: codebase. troubleshoot issues. * hands-on , setting maintaining team. * mentorship , reviewing documents changes. **qualifications** "
management_strong,linkedin_li-4381308673,scraped,2026-03,Odyssey,supervise,"** summary** | ** ** situational multi-domain ( ) programs. focuses , , next-generation battlefield , , capabilities. closely multidisciplinary , , , , actionable advantage. brings expertise , , , contributing mission-critical multi-domain "
management_strong,linkedin_li-4346659535,scraped,2026-03,NTT DATA North America,manage,"currently - azure/ aws , (us-tx), ( ) * aligns * model. , , spanning , aws, (gcp), ( ) demands multi-cloud expertise, , , problem-solving outlook. participate , management. | \& , , maintain aws, , gcp, oci. , troubleshoot, incidents, , out"
management_strong,linkedin_li-4388750243,scraped,2026-03,"Quest, Inc.",mentor,"' ai deeply pushes grow. chatbot. assistant. observes , understands , - not. ' actually ai grow. chatbot. mentor. spend , understands , , asked not. problems aren' ' seen : * profiling — actually understand emails, , messages, ? facts. unde"
management_strong,linkedin_li-4369982392,scraped,2026-03,FloQast,mentor,", , , , high-performance platform. , ' , tackling , , influencing ' strategy. , cloud-native problems , you. * : , defining , , utilizing serverless containerization * : designing , ensuring durability, , , performance. * : , , slis, slos, "
management_strong,linkedin_li-4388600265,scraped,2026-03,TalentAlly,mentor,"* : develops derivatives-based classes clients. * : proprietary back-office , including reconciliation, , , , reduce risk. , , , including proprietary systems. ** ' ** | * robust, , maintainable stack. * , including , persistence layers, ev"
management_strong,linkedin_li-4386502207,scraped,2026-03,OnMed,mentor,"** ** senior-level designing cloud-first environments. bring expertise , , governance ecosystems. - , , interoperability, systems. comfortable hands-on level. high-growth motivated leveraging healthcare. * , , enterprise-grade services. * ,"
management_strong,linkedin_li-4395293961,scraped,2026-04,FlightSafety International,mentor,"hands-on architecting, , cloud-based environment. provides ** ** | ** ** , ensuring , , reporting. plays , , enabling actionable dashboards reports. tasks | * , ensuring * mentorship * etl/elt (adf), , * \.0 consistency * orchestrate workfl"
management_strong,linkedin_li-4366796128,scraped,2026-04,Cubic Corporation,manage,"hands-on kubernetes rke2, openshift, ci/cd customer-site deployments restricted focuses , ci/cd enablement, execution. maintaining ci/cd capabilities. * capabilities openshift * capabilities * repeatable, deployments * , configuration, upgr"
management_strong,linkedin_li-4371606649,scraped,2026-03,Early Warning®,hire,"responding independently possess eligibility , , hire. ineligible sponsorship. ** ** provides cross-border – , problems regulated flows. ** ** * cross-border , including , reconciliation, components. * , , , , requirements. * , event-driven"
management_strong,linkedin_li-4397133945,scraped,2026-04,Elwyn,supervise,", , , maintain, operate elwyn. serverless implementations , including initiation, , , , , deployment. collaborates , cycles. **duties ** * , develops, maintains, operates ( ) * defines used dependent * implementations , including initiation"
management_strong,linkedin_li-4397504741,scraped,2026-04,First Citizens Bank,supervise,"hands-on provides following : , ( , ) \& movement. necessary , estimation , deciding desired , , differing gray/unknowns, , contributors, stakeholders. execution requests constraints. short- long-term deciding approach. effectively members."
management_strong,linkedin_li-4240184390,scraped,2026-03,Norm Ai,mentor,"ai expects ai. ai day-to-day , , problem-solving. improve continuously refine end-to-end. demonstrate discuss ai , including examples , workflows, outcomes. , hands-on , theoretical familiarity. ai, , ai-driven platform. ' , , ai , foundati"
management_strong,linkedin_li-4394202457,scraped,2026-04,"Global Soft Systems, Inc.",manage,"** ** team. backend , microservices , integrating angularjs. , , maintain backend ** ** | ** ** maintain restful **angularjs** | ** ** , querying, optimization. contribute ci/cd | ** ** | ** ** deployments. , following practices. troublesho"
management_strong,linkedin_li-4390198268,scraped,2026-03,The Doyle Group,mentor,"** ** ** summary** , , organization. strengthening , capabilities, azure-based environment. deeply hands-on, brings kubernetes , introduce , documentation, repeatable fast-moving team. closely , , , , modernization initiatives. enabling ’ b"
management_strong,linkedin_li-4310506698,scraped,2026-03,OCLC,"mentor, supervise","’ hands-on large-scale, used worldwide. enjoys designing robust , , influencing high-quality code. ** ** | ** \& ** * large-scale production. * , java-based , , patterns. * establish , including , , observability, documentation. * , , trade"
management_strong,linkedin_li-4375989020,scraped,2026-03,mthree,hire,"** ’ :** engineer/analyst , ’ , algorithmic reporting. technology. engineer/analyst , ’ on. completed, considered , , , , , operations. 4. 12-24 receiving regular increases. * discuss , including itil ( ), , , ( ), recovery. * discuss topic"
management_strong,linkedin_li-4382460312,scraped,2026-04,ModMed,mentor,", , high-performing team. available, high-traffic, robust fast-paced modernizing ! ** ' ** | * , , objectives. * mentorship, , team. * contribute roadmap cross-functional , ensuring objectives. * requirements manageable deliverables specifi"
management_strong,linkedin_li-4369489372,scraped,2026-03,Microsoft,hire,"! microservices real-time studios. problems quality. ** ** | * collaborates determine user requirements scenario. dependencies documents , , , platform. , implements, optimizes, debugs, refactors, reuses establish improve maintainability, ,"
management_strong,linkedin_li-4344495970,scraped,2026-04,Industrial Electric Mfg. (IEM),supervise,"** summary** | ** ** , providing , qualification, manufacturing. ensures , , management. supervisory cross-functional engineers. ** ** include following : * (poc) ( ) and/or products. * qualifying , * introduction schedules , cross-product "
management_strong,linkedin_li-4363865536,scraped,2026-03,Uber,mentor,"owns end-to-end advertiser-side , , formats types. , workflows, unblock spanning , , , , non-endemic ads. backend , ' foundational , , outsized enabling next scale. ** ** * backend formats * , , used * closely , , translate * , mentorship, "
management_strong,linkedin_li-4365868687,scraped,2026-03,General Dynamics Mission Systems,hire,"requires bachelor’ , , , field. requires \ job-related , ' job-related experience. preferred. obtain hire. applicants eligibility requirements classified information. performed , citizenship required. , ’ cockpit, identifying , weapon , ' m"
management_strong,linkedin_li-4378979842,scraped,2026-03,"ThinKom Solutions, Inc.",manage,"- conducting assessments, breakdown , interactions , used design. , , , , manager. outlines , usability, , needs. documentation systems. facilitates commercial-off-the-shelf evaluations. additional include analyzing use-cases assure compati"
management_broad,arshkon_3887907452,kaggle_arshkon,2024-04,"Niantic, Inc.","stakeholder, collaborate","’ seeks researchers user generative ai capabilities , geo-based, productionizing models. capabilities platforms. maintain generative ai models.develop workflows.optimize utilization minimize latency inference.implement maintain alerting ai "
management_broad,asaniczka_0eb67f6e53207be2,kaggle_asaniczka,2024-01,"T-Rex Solutions, LLC","team, coordinate","t-rex on-site meade. considered cleared. develops, maintains, enhances (e.g., processing-intensive , algorithm , manipulation extremely sets, real-time , ) documented requirements. individually team. adherence requirements documents results"
management_broad,asaniczka_e1024e0477e367d6,kaggle_asaniczka,2024-01,Wabtec Corporation,team,"modernization introduction recognized field. assignments long-term implications, ( ) expertise, contribute strategy. team. : | and/or modernization , , implementation. ( ) expertise contribute strategy. assignments long-term implications, c"
management_broad,asaniczka_1b869b78ed5f3ae5,kaggle_asaniczka,2024-01,Walmart,stakeholder,"' | , , maintain high-performance front-end 1p customers. robust, maintainable, reusable functionality, configuration, , , , , , , alerting , , environments. potentially reconfiguration, , , ' functionality, , usability, understand business"
management_broad,asaniczka_b886c2c837d0425a,kaggle_asaniczka,2024-01,"iRhythm Technologies, Inc.",team,"revolutionize rigorous emphasis products. , ' closely , existing. strategize, execute, improve methodologies, ensuring requirements. , ultimately contributing products. include | system-level testability requirements. creatively efficiently"
management_broad,asaniczka_8a7d7aa0bb5bdbce,kaggle_asaniczka,2024-01,Peterson Technology Partners,team,"site. additionally, requires delivering experience. duties : | contribute testable idiomatic patterns. , , software. experience. ensuring short- long-term understood contributors. communicate delivering upsteam platform. ownership. executio"
management_broad,asaniczka_237071460ea63865,kaggle_asaniczka,2024-01,Flexjet,team,"currently team. designing, , troubleshooting utilized business. analyze requirements applications. existing lifecycle. introduce colleagues needs. abreast techniques. users , , roles. & | 5+ bachelor’ additional object-oriented (oop), relat"
management_broad,arshkon_3902364167,kaggle_arshkon,2024-04,Microsoft,"team, collaborate",", multi-disciplinary, multi-million, multi-year , , , goals. dpx architecting, designing, next microservices , , , , commissioning, , manner. specializing ariba strategice robust next , ml , recommendation , , execution integrating bigger c"
management_broad,asaniczka_361aadbc7ab12816,kaggle_asaniczka,2024-01,Bank of America,"stakeholder, collaborate",", , ( ) (openshift /aks) platform. (csres) requirements demanding customers. achieved , well-defined on-call rotation runs 24x7. provides (on-prem/off-prem) other. colleagues , hardworking, you. keeps , innovating, creative. next ? ’ ! summ"
management_broad,arshkon_3904714530,kaggle_arshkon,2024-04,FastTek Global,team,"(dnee) focuses used tracking functions.specifically , enrollment & (dpei) , tracks , is/can , agreements.the , maintaining rewrite/modernization dpes ' updated modernized form.the written , backend.the , , written/modernized , angular, spri"
