uid,company_name_canonical,company_name_effective,title,cleaned_text,requirements_text,requirements_tokenized,tech_hits,org_hits,ai_tool_hits,ai_domain_hits,hedge_hits,firm_hits,scope_hits,tech_count,org_count,hedge_count,firm_count,scope_count,aspiration_ratio,ai_any,ai_rate_per_1k_chars,is_junior,is_entry_like,period,seniority_3level,is_aggregator,company_size,yoe_extracted,requirements_signature,kitchen_sink_tech,kitchen_sink_org,aspiration_saturated,yoe_scope_mismatch,ghost_row_score_raw,company_repetition_flag,template_saturation,within_company_nn_sim,within_company_mean_sim,within_company_max_sim,company_repetition,ghost_like
linkedin_li-4388198120,CGI,CGI,DevOps Engineer,"Position Description The Best version of us, starts with You! We CGI is seeking to hire a motivated DevOps Engineer to join our team and play a role in shaping our cloud infrastructure and DevOps practices. You will be a key driver in designing, implementing, and managing our cloud infrastructure on AWS, ensuring high availability, scalability, and security for our CI/CD pipeline to support our internal partners. This role requires a deep understanding of AWS services, CI/CD pipelines using DevOps technologies -- GitHub, Artifactory, and Jenkins, proven expertise in scripting with Python, Bash, and Groovy, and significant experience with Unix, Java and SQL. This is a Full Time Employment Opportunity based in Jersey City, NJ, currently in a HYBRID working Model. Your future duties and responsibilities * Design and implement robust and scalable cloud infrastructure solutions on AWS, leveraging best practices for security, performance, and cost optimization. * Lead the development and implementation of automated CI/CD pipelines, fostering a culture of continuous integration and delivery within the team. * Implement and manage comprehensive monitoring, logging, and alerting systems to ensure the health and performance of our applications and infrastructure. * Champion security best practices throughout the software development lifecycle, ensuring the protection of sensitive financial data. * Collaborate closely with development teams to integrate DevOps methodologies, streamline workflows, and optimize the software development lifecycle. * Proactively identify and resolve infrastructure bottlenecks, performance issues, and security vulnerabilities. * Conduct research and development on emerging technologies and industry best practices to continuously improve our DevOps practices and infrastructure. **Required Qualifications To Be Successful In This Role** At least 10\+ years of proven experience as a DevOps Engineer, demonstrating progressive growth and leadership in previous roles. * Deep understanding of AWS services (EC2, S3, ECS, Lambda, IAM, etc.) and extensive experience with CloudFormation. * Mastery of scripting languages: Python (must-have), Bash (must-have), and Groovy (highly preferred). * Significant experience with Java and SQL, demonstrating the ability to integrate diverse technologies. * Proven experience with a wide range of CI/CD tools like GitLab CI, or AWS Code Pipeline. * Deep understanding of containerization technologies like Docker and Kubernetes. * Extensive experience with monitoring and logging tools such as Datadog. * Expert-level proficiency in Unix/Linux environments. * Exceptional problem-solving and analytical skills, with a strong ability to troubleshoot complex technical issues. * Excellent communication and collaboration skills, with a proven ability to work effectively within a team and communicate technical concepts clearly. * Experience within the financial services industry and a strong understanding of related regulations and compliance requirements. * AWS certifications (e.g., AWS Solutions Architect Professional, AWS DevOps Engineer Professional). Education: Bachelor's degree in computer science or related field. CGI is required by law in some jurisdictions to include a reasonable estimate of the compensation range for this role. The determination of this range includes various factors not limited to skill set, level, experience, relevant training, and licensure and certifications. To support the ability to reward for merit-based performance, CGI typically does not hire individuals at or near the top of the range for their role. Compensation decisions are dependent on the facts and circumstances of each case. A reasonable estimate of the current range for this role in the U.S. is $95,500\.00 - $211,600\.00\. CGI's benefits are offered to eligible professionals on their first day of employment to include: **Together, as owners, let’s turn meaningful insights into action.** Life at CGI is rooted in ownership, teamwork, respect and belonging. Here, you’ll reach your full potential because… You are invited to be an owner from day 1 as we work together to bring our Dream to life. That’s why we call ourselves CGI Partners rather than employees. We benefit from our collective success and actively shape our company’s strategy and direction. Your work creates value. You’ll develop innovative solutions and build relationships with teammates and clients while accessing global capabilities to scale your ideas, embrace new opportunities, and benefit from expansive industry and technology expertise. You’ll shape your career by joining a company built to grow and last. You’ll be supported by leaders who care about your health and well-being and provide you with opportunities to deepen your skills and broaden your horizons. Come join our team—one of the largest IT and business consulting services firms in the world. CGI provides reasonable accommodations to qualified individuals with disabilities. If you need an accommodation to apply for a job in the U.S., please email the CGI U.S. Employment Compliance mailbox at US\_Employment\_Compliance@cgi.com. You will need to reference the Position ID of the position in which you are interested. Your message will be routed to the appropriate recruiter who will assist you. **Please note, this email address is only to be used for those individuals who need an accommodation to apply for a job. Emails for any other reason or those that do not include a Position ID will not be returned.** We make it easy to translate military experience and skills! Click here to be directed to our site that is dedicated to veterans and transitioning service members. All CGI offers of employment in the U.S. are contingent upon the ability to successfully complete a background investigation. Background investigation components can vary dependent upon specific assignment and/or level of US government security clearance held. Dependent upon role and/or federal government security clearance requirements, and in accordance with applicable laws, some background investigations may include a credit check. CGI will consider for employment qualified applicants with arrests and conviction records in accordance with all local regulations and ordinances. CGI will not discharge or in any other manner discriminate against employees or applicants because they have inquired about, discussed, or disclosed their own pay or the pay of another employee or applicant. However, employees who have access to the compensation information of other employees or applicants as a part of their essential job functions cannot disclose the pay of other employees or applicants to individuals who do not otherwise have access to compensation information, unless the disclosure is (a) in response to a formal complaint or charge, (b) in furtherance of an investigation, proceeding, hearing, or action, including an investigation conducted by the employer, or (c) consistent with CGI’s legal duty to furnish information.","Qualifications To Be Successful In This Role** At least 10\+ years of proven experience as a DevOps Engineer, demonstrating progressive growth and leadership in previous roles. * Deep understanding of AWS services (EC2, S3, ECS, Lambda, IAM, etc.) and extensive experience with CloudFormation. * Mastery of scripting languages: Python (must-have), Bash (must-have), and Groovy (highly preferred). * Significant experience with Java and SQL, demonstrating the ability to integrate diverse technologies. * Proven experience with a wide range of CI/CD tools like GitLab CI, or AWS Code Pipeline. * Deep understanding of containerization technologies like Docker and Kubernetes. * Extensive experience with monitoring and logging tools such as Datadog. * Expert-level proficiency in Unix/Linux environments. * Exceptional problem-solving and analytical skills, with a strong ability to troubleshoot complex technical issues. * Excellent communication and collaboration skills, with a proven ability to work effectively within a team and communicate technical concepts clearly. * Experience within the financial services industry and a strong understanding of related regulations and compliance requiremen",qualifications be successful role proven demonstrating progressive growth leadership previous roles ec2 iam etc extensive with cloudformation mastery scripting languages must-have bash must-have groovy highly significant with java sql demonstrating ability proven with ci/cd like gitlab ci or pipeline containerization like kubernetes extensive with such expert-level proficiency unix/linux environments exceptional problem-solving analytical skills with strong ability troubleshoot issues excellent communication collaboration skills with proven ability effectively within communicate clearly within industry strong related regulations requirements certifications architect bachelor degree or related required some jurisdictions include reasonable estimate,"['python', 'java', 'docker', 'kubernetes', 'aws', 'sql', 'ci_cd', 'linux']","['ownership', 'lead', 'manage', 'team', 'collaboration', 'communication', 'problem_solving', 'partner', 'strategic']",[],[],['preferred'],"['required', 'need', 'essential']","['ownership', 'architecture', 'scalability']",8,9,1,3,3,0.3333333333333333,False,0.0,True,True,2026-03,junior,False,,,bb20c9717694efb654c8eab63cb2f8a98ebb3c77,False,True,False,True,2,True,True,1.0000000000000004,0.1318946891752597,1.0000000000000004,True,4
linkedin_li-4387728717,Plymouth Rock Assurance,Plymouth Rock Assurance,Artificial Intelligence Engineer,"We are seeking a highly skilled AI Engineer to design and build Generative and Agentic AI systems that transform how our company operates and serves customers. This role focuses on developing AI applications powered by large language models (LLMs), retrieval-augmented generation (RAG), Model Context Protocol (MCP) servers, and Agentic AI across the enterprise for internal and customer facing use cases. The ideal candidate has strong experience with a modern AI/ML stack, including a profound Python experience, including AI relevant packages and tools, LLM architectures and frameworks, RAG, MCP, prompt engineering, use of AI tools, budling teams of AI agents, and production-grade AI systems design and development. You will work closely with technology, data, and business teams to build scalable AI solutions that drive operational efficiency and innovation across the enterprise. **Key Responsibilities** * Design, build, and deploy scalable LLM-powered applications, solutions, and digital products for customer support, business use cases, and internal productivity. * Develop AI agents, Agentic Platforms, and Agentic AI systems capable of reasoning, planning, and executing multi-step workflows. * Implement Retrieval-Augmented Generation (RAG) architectures and pipelines to leverage proprietary data, and internal knowledge bases. * Build MCP servers, multi-connectivity enabled and multi-modal Agentic platforms, and AI assistants to support internal teams and customer facing. * Integrate AI/ML solutions with enterprise systems, APIs, and data platforms. * Design prompt strategies, evaluation frameworks, and guardrails to ensure accuracy, security, and regulatory compliance. * Optimize LLM performance through fine-tuning, prompt engineering, and model orchestration. * Develop MLOps and LLMOps pipelines for monitoring, evaluation, and continuous improvement of AI systems. * Help in forming buy or build decisions and work with external vendors, consultants and internal teams to deliver scalable top-quality AI solutions timely. * Stay up to date with emerging advancements in AI/ML, Generative AI, Agentinc frameworks, and model architectures. **Required Qualifications** * Bachelor’s or Master’s degree in Computer Science, Artificial Intelligence, Machine Learning, Applied Mathematics, or related field. * 2\+ years of software engineering experience, including work with machine learning (ML) or AI systems. * Hands-on experience building LLM-powered applications in production environments. * Strong programming skills in Python, and familiarity with AI/ML relevant packages such as NumPy, Pandas, SciPy and Scikit-learn. * Experience with LLM ecosystems such as: + OpenAI / Anthropic / Google, Open-source LLMs + Hugging Face + LangChain, LlamaIndex, or similar orchestration frameworks * Experience building RAG pipelines and working with vector databases. * Understanding of prompt engineering, embeddings, and model evaluation. * Experience building APIs, MCPs, and scalable backend services. * Experience with Claude Code, Codex, Cursor, GitHub Copilot, or similar. * Ability to collaborate with cross-functional teams. * Passion for technology and AI. **Preferred Qualifications** * Experience building AI agents, agentic platforms, or autonomous workflows. * Familiarity with agent frameworks (LangGraph, AutoGen, CrewAI, Semantic Kernel, Frontier, etc.). * Experience with fine-tuning LLMs or parameter-efficient training methods (LoRA, PEFT). * Experience with cloud-based AI infrastructure (AWS, Azure, or GCP). * Familiarity with Java, JS, and Java applications and environments. * Experience with MLOps / LLMOps tools and evaluation pipelines. * Experience implementing AI governance, observability, and guardrails. **Perks And Benefits** * 4 weeks accrued paid time off \+ 9 paid national holidays per year * Free onsite gym at our Boston Location * Tuition Reimbursement * Low cost and excellent coverage health insurance options that start on Day 1 (medical, dental, vision) * Robust health and wellness program and fitness reimbursements * Auto and home insurance discounts * Matching gift opportunities * Annual 401(k) Employer Contribution (up to 7\.5% of your base salary) * Various Paid Family leave options including Paid Parental Leave * Resources to promote Professional Development (LinkedIn Learning and licensure assistance) * Convenient location directly across from South Station and Pre-Tax Commuter Benefits **","Qualifications** * Bachelor’s or Master’s degree in Computer Science, Artificial Intelligence, Machine Learning, Applied Mathematics, or related field. * 2\+ years of software engineering experience, including work with machine learning (ML) or AI systems. * Hands-on experience building LLM-powered applications in production environments. * Strong programming skills in Python, and familiarity with AI/ML relevant packages such as NumPy, Pandas, SciPy and Scikit-learn. * Experience with LLM ecosystems such as: + OpenAI / Anthropic / Google, Open-source LLMs + Hugging Face + LangChain, LlamaIndex, or similar orchestration frameworks * Experience building RAG pipelines and working with vector databases. * Understanding of prompt engineering, embeddings, and model evaluation. * Experience building APIs, MCPs, and scalable backend services. * Experience with Claude Code, Codex, Cursor, GitHub Copilot, or similar. * Ability to collaborate with cross-functional teams. * Passion for technology and AI. **Preferred Qualifications** * Experience building AI agents, agentic platforms, or autonomous workflows. * Familiarity with agent frameworks (LangGraph, AutoGen, CrewAI, Semantic Kernel, Fron",qualifications bachelor or degree artificial mathematics or related including with or hands-on llm-powered production environments strong skills familiarity with ai/ml relevant packages such numpy pandas scipy scikit-learn with llm ecosystems such open-source llms hugging face llamaindex or similar orchestration frameworks rag pipelines working with databases prompt embeddings evaluation apis mcps backend with claude codex cursor copilot or similar ability with cross-functional teams passion qualifications agentic platforms or workflows familiarity with agent frameworks langgraph autogen crewai semantic etc with fine-tuning llms or parameter-efficient methods lora peft with cloud-based azure or gcp familiarity with java js java environments with mlops llmops evaluation pipelines implementing governance observability guardrails perks,"['python', 'java', 'javascript', 'aws', 'gcp', 'azure', 'scikit_learn']","['cross_functional', 'autonomous', 'team', 'collaboration', 'drive']","['copilot', 'cursor', 'claude', 'llm', 'rag', 'agent', 'mcp', 'openai']",['machine_learning'],['preferred'],['required'],"['scalability', 'cross_functional', 'autonomous']",7,5,1,1,3,1.0,True,2.0134228187919465,True,True,2026-03,junior,False,,,dc739f7657daf84c828b6f3470398e8a009e78e6,False,False,True,True,2,True,True,1.0000000000000004,1.0000000000000004,1.0000000000000004,True,4
arshkon_3905338566,Navy Federal Credit Union,Navy Federal Credit Union,Digital Engineer III (Azure Data Engineer),"Overview In Digital, we develop innovative member and team member experiences that leverage the latest technologies in open source and the Cloud. Digital Information Management (DIM) is a team of engineers committed to championing a data-driven decision-making culture and meets the business demand for timely insight-focused analytics and information delivery. You will be working with all levels of technology from backend data processing technologies (Databricks/Apache Spark) to other Cloud computing technologies / Azure Data Platform. You should be a strong analytical thinker, detail-oriented and love working with data with a strong background in data engineering and application development. Must be a hand-on technologist passionate about learning new technologies and help improve the ways we can better leverage Advanced Analytics and Machine Learning. Build end-to-end direct capabilities.Create and maintain optimal data pipeline architecture.Build the infrastructure required for optimal extraction, transformation, and loading of data from a wide variety of data sources.Use analytics for capitalizing on the data for making decisions and achieving better outcomes for the business.Derive insights to differentiate member and team member experiences. Collaborate with cross-functional teams.Analyze and define with product teams the data migration and data integration strategies.Apply experience in analytics, data visualization and modeling to find solutions for a variety of business and technical problems.Querying and analyzing small and large data sets to discover patterns and deliver meaningful insights. Integrate source systems with information management solutions and target systems for automated migration processes.Create proof-of-concepts to demonstrate viability of solutions under consideration. Bachelor’s degree in computer science, information systems, or other technology-related field or equivalent number of years of experience.Advanced hands-on experience implementing and supporting large scale data processing pipelines and migrations using technologies (eg. Azure Services, Python programming).Significant hands-on experience with Azure services such as Azure Data Factory (ADF), Azure Databricks, Azure Data Lake Storage (ADLS Gen2), Azure SQL, and other data sources. Significant hands-on experience designing and implementing reusable frameworks using Apache Spark (PySpark preferred or Java/Scala).Solid foundation in data structures, algorithms, design patterns and strong analytical and problem-solving skills.Strong hands-on experience leading design thinking as well as the ability to translate ideas to clearly articulate technical solutions. Experience with any of the following Analytics and Information Management competencies: Data Management and Architecture, Performance Management, Information Delivery and Advanced Analytics. Desired Qualifications Proficiency in collaborative coding practices, such as pair programming, and ability to thrive in a team-oriented environment.The following certifications:Microsoft Certified Azure Data EngineerMicrosoft Certified Azure Solutions ArchitectDatabricks Certified Associate Developer for Apache 2.4/3.0 Hours: Monday - Friday, 8:00AM - 4:30PM Location: 820 Follin Lane, Vienna, VA 22180 | 5510 Heritage Oaks Drive Pensacola, FL 32526 | 141 Security Drive Winchester, VA 22602","Qualifications Proficiency in collaborative coding practices, such as pair programming, and ability to thrive in a team-oriented environment.The following certifications:Microsoft Certified Azure Data EngineerMicrosoft Certified Azure Solutions ArchitectDatabricks Certified Associate Developer for Apache 2.4/3.0 Hours: Monday - Friday, 8:00AM - 4:30PM Location: 820 Follin Lane, Vienna, VA 22180 | 5510 Heritage Oaks Drive Pensacola, FL 32526 | 141 Security Drive Winchester, VA 22602",qualifications proficiency collaborative coding practices such pair ability team-oriented environment following certifications certified azure engineermicrosoft certified azure architectdatabricks certified apache hours monday friday pm location follin lane vienna va oaks pensacola fl winchester va,"['python', 'java', 'azure', 'sql', 'spark', 'databricks']","['ownership', 'cross_functional', 'lead', 'manage', 'team', 'collaboration', 'problem_solving', 'drive', 'decision_making']",[],['machine_learning'],"['preferred', 'desired']",['required'],"['ownership', 'architecture', 'cross_functional']",6,9,2,1,3,2.0,True,0.2958579881656805,True,True,2024-04,junior,False,20061.0,,f670b0658744e607431592e0e97ee044dfe0eabf,False,True,True,True,3,False,True,1.0000000000000002,0.26241174549354823,1.0000000000000002,False,4
