uid,source,period,title,company_name_canonical,seniority_final,yoe_extracted,text_source,text_len,tech_count,ai_count,soft_skill_count,scope_count,management_strong_count,management_broad_count,education_level,requirement_breadth,credential_stack_depth,tech_density,scope_density,excerpt
linkedin_li-4393038157,scraped,2026-04,Software Engineer,Mount Indie,unknown,6.0,llm,1517,9,2,1,1,0,0,none,14,5,5.932762030323006,0.6591957811470006,"cloud-native \ (ndds), mugu, california. ** ** * cloud-native , won' code. ' ndds platform. ' , , high-availability, microservices cutting-edge platforms. , tangible highest importance. specifically: * \& : robust, microservices, next-gener"
linkedin_li-4389936522,scraped,2026-03,Senior AI Machine Learning Engineer,ThinkTrends,mid-senior,7.0,llm,1516,7,5,1,0,0,2,none,14,4,4.617414248021108,0.0,"| ** ai ** | ** \ ** ai team. , ' , , , , actions problems. ai environment. ** ** ** ai ** * ai (llms) * multi-agent , communicate, coordinate * capabilities decision-making * tool-using , databases, * stateful interactions ** \& ** * llms "
asaniczka_efc4ca39e8c37476,kaggle_asaniczka,2024-01,Sr Java Engineer,Labcorp,mid-senior,10.0,llm,1489,9,0,1,1,2,1,none,14,5,6.044325050369375,0.6715916722632639,"searching expert-level industry. formed contribute implementing (restful ) applicant challenged cutting-edge java/linux-based virtualized , (iaas) applicant workflows prospective , including , , , coaching/mentoring adopting platforms. team"
linkedin_li-4390388156,scraped,2026-03,Full Stack Developer,Stefanini North America and APAC,unknown,3.0,llm,1467,12,0,1,0,0,0,none,14,3,8.1799591002045,0.0,"expertise scale. categories: backend , microservices robust , full-stack , ui/ux , platform. hands-on ci/cd, independently , , , efficiently. ** ** | * : , , maintain microservices real-time gcp. * service-oriented (soa) microservices: soa "
linkedin_li-4391678875,scraped,2026-03,Senior Software Engineer,Envoy AI,mid-senior,4.0,llm,1454,7,4,0,2,0,0,none,14,4,4.814305364511692,1.375515818431912,"brokerages , chasing updates, jumping dozen tools. ' end. makes , , verifies , sends check-ins, chases documents. ' 3pls shipments today. : orchestrating thousands , executing workflows real-time, integrating decades existed. ' full-stack e"
linkedin_li-4389758800,scraped,2026-03,Senior Fullstack Software Engineer,Apex Systems,mid-senior,8.0,llm,1400,12,0,0,1,0,1,none,14,3,8.571428571428571,0.7142857142857143,"following : * \ * ‑ : ; ‑frontends ( \ ), ui workflows (drag/drop, , ‑ ), builder. * ‑ : node.js (express/hapi), sequelize orm → postgres; rabbitmq; ; permissions models. * aws : , , sns, dynamodb, , opensearch, , elb; eks/kubernetes ; host"
linkedin_li-4304582967,scraped,2026-04,Staff Software Engineer,Zinnia,mid-senior,4.0,llm,1330,11,0,0,2,0,1,none,14,3,8.270676691729323,1.5037593984962405,", execute , frictionless, api-first , end-to-end \& annuities industry. reusable, , discoverable , enabling , consistent, maintainable enterprise. , api expertise, delivery. combine hands-on , ensuring strategically implemented. ** ’ ** | *"
linkedin_li-4344085010,scraped,2026-04,AI/ML Engineer,FTI Defense - Frontier Technology Inc.,unknown,6.0,llm,1322,0,12,0,1,0,0,none,14,3,0.0,0.75642965204236,"( ) hands-on ai/ml , , missions. focuses execution , thrives , enjoys end-to-end , takes seeing systems. ** ** | * , , ai/ml objectives. * , , fine-tune pytorch, tensorflow, scikit-learn, hugging , langchain. * operationalize mlops (mlflow,"
asaniczka_dd17f17d7ad7ac21,kaggle_asaniczka,2024-01,Senior / Principal Full-Stack Enterprise Developer,EG America,mid-senior,7.0,llm,1319,8,0,1,2,1,0,ms,14,6,6.0652009097801365,1.5163002274450341,"full-stack ( ) designing, & ( , & ) demonstrated , including , , , debugging, methodologies. cross-functional ' cycle. comfortable front-end back-end , libraries. participate & applications. maintain/optimize existing directed. continuously"
arshkon_3904969494,kaggle_arshkon,2024-04,Full Stack Engineer,Seneca Resources,unknown,3.0,llm,1295,11,0,1,1,0,1,none,14,4,8.494208494208495,0.7722007722007722,", c2c. | : developerlocation: , vaenvironment: on-siteposition : long-term contractpay : $78/hr. : , designing, , maintaining robust facilitate , , datasets. expertise , , , users. : maintain , , analytics.utilize solutions.implement , ique"
linkedin_li-4391124543,scraped,2026-03,Software Engineer 4,PTR Global,unknown,5.0,llm,1290,11,0,0,1,1,1,none,14,4,8.527131782945736,0.7751937984496124,"** :** ** :** , used execute statistical , approvals. enables statisticians datasets statistical models. manages evolves , migrated (gcp) complexity workloads requires proficiency gcp, , containerized microservices, processing. , large-scal"
asaniczka_8c4ab52353a302b8,kaggle_asaniczka,2024-01,Software Engineer Lead-AWS Cloud,USAA,unknown,6.0,llm,1282,12,0,0,1,0,2,none,14,3,9.360374414976599,0.7800312012480499,"enthusiastic modernization journey. premises premises experience. plays , , validations process. complaint manner. expertise objectives sensitive execution & self-starter “ ” improvement. provides delivering include analyzing requirements, "
asaniczka_ad1151c458366f74,kaggle_asaniczka,2024-01,Principal Full Stack Developer - NodeJS,Hub Group,mid-senior,3.0,llm,1273,10,0,1,2,0,2,none,14,4,7.855459544383346,1.5710919088766693,", large-scale (cloud-based ) taking , , , organization. , utilize in-depth delivering expertise hands-on embodies delivering high-quality strategically products. critically evaluate trade-offs contending implementations communicate stakehol"
arshkon_3906250673,kaggle_arshkon,2024-04,"Associate, Java/J2EE Backend Developer",BlackRock,unknown,5.0,llm,1246,9,0,2,1,0,0,bs,14,5,7.223113964686998,0.8025682182985554,"backend , ' called aladdin. : paced thinker: analyze way. teammate: collaboratively communicate effectively. learner: quickly. include | multi-office, multi-country environment. , , fault tolerant systems. significantly contribute ’ , multi"
linkedin_li-4391094368,scraped,2026-03,Full Stack AI Developer,InSite,mid-senior,3.0,llm,1244,8,4,0,1,0,0,none,14,4,6.430868167202572,0.8038585209003215,"** – ai ** ** :** | \& ai ** ** mid-to-senior ai ( \ ) , , , ai/ml production-grade environment. requires understands : | * ai , including llms, , , * , , full-stack ai operate real-world , , data. ** ** **ai \& ** * , , fine-tune, ml/ai ( "
linkedin_li-4389915141,scraped,2026-03,Senior Full Stack Engineer,Fidelity Investments,mid-senior,6.0,llm,1226,12,0,0,1,0,2,none,14,3,9.787928221859707,0.8156606851549756,"** ** | ** –** deeply entrenched , , robust, initiatives. ** expertise ** * \ designing implementing end-to-end facing * bachelor’ , , * scrum * front-end including angular ( \ ), node.js, html/css, javascript typescript, , other. * ( \ ), "
linkedin_li-4390885884,scraped,2026-03,DevOps Engineer,Schellman,unknown,2.0,llm,1209,10,2,0,1,0,1,none,14,4,8.271298593879239,0.8271298593879239,"plays maintaining deployments. , independently allowing , excessive impediments. , conveys ""fast-paced "" ' siloed area. * important : regular morning/evening deployments on-call rotations. * identify, , aws , , observability * automation/pe"
linkedin_li-4327290738,scraped,2026-04,"Software Engineer, III",Blue Sage Solutions,unknown,3.0,llm,1187,10,0,1,0,1,1,bs,14,5,8.424599831508003,0.0,", ( ), go-between , ensuring produces , problems varying complexities. comprehend suggestions , , , providing mentorship higher-level team. requires expertise , (specifically ) api integrations. : | * api \& : robust api third-party service"
linkedin_li-4388959268,scraped,2026-03,Sr. Staff Software Engineer,GEICO,mid-senior,15.0,llm,1167,12,0,0,1,0,0,none,14,3,10.282776349614396,0.856898029134533,", improve existing identify problems. execution roadmap modernizing , including modernization, migration. ’ ** breadth** — cloud-native architectures patterns. | ** , ** * * problems * high-scale high-quality , especially legacy-to-modern t"
linkedin_li-4390105239,scraped,2026-03,Principal Software Engineer,"Modern Technology Solutions, Inc. (MTSI)",mid-senior,7.0,llm,1167,9,0,4,0,0,2,none,14,3,7.712082262210797,0.0,"defining next (ussf) communications. \& ( \& ) multidisciplinary environment. \& , , civilians ussf. discussion, identify , requirement gaps, briefings, , tracking items, authoring minutes. ** ** * , , analyze, prototypes and/or multi-disci"
linkedin_li-4373028920,scraped,2026-04,Senior Software Engineer,ModMed,mid-senior,5.0,llm,1147,10,1,1,1,0,1,none,14,5,8.718395815170009,0.8718395815170009,"** summary** | ** ** , , high-performing team. available, high-traffic, robust fast-paced modernizing ! ** ** | * , , , , maintain high-quality, , practices. * closely , ux/ui , requirements, specifications, delivery. * discussions, , contr"
arshkon_3905236869,kaggle_arshkon,2024-04,Senior Software Engineer,Incident IQ,mid-senior,3.0,llm,1135,11,0,2,0,0,2,none,14,3,9.691629955947137,0.0,": ( ) : ( ), ( ) : ( ) : summarywe c#.net top-tier cloud-based application. c#.net. qualifications & : minimum applications. c# / .netstrong c# , including , async/await, generics.experience 5/6+ essential.experience consuming restful api.e"
asaniczka_ecb5f42c2b78f4c1,kaggle_asaniczka,2024-01,Senior Lead AWS Cloud Engineer (Full-Time),Allnessjobs,mid-senior,10.0,llm,1135,10,0,1,1,1,1,none,14,5,8.810572687224669,0.8810572687224669,"aws team. , overseeing , , aws engineers. closely , , aws , , performance. aws , , successfully delivering projects. closely , , automate ' aws , ci/cd automate tasks, containerized python/java. | , , aws execution , cloudformation, ansible"
linkedin_li-4366658798,scraped,2026-04,Sr Software Engineer,Resideo,mid-senior,,llm,1134,10,0,3,1,0,1,none,14,3,8.818342151675486,0.8818342151675485,", millions , , , world-class company-wide initiatives. designing, , integrating iot/connected devices. , intrusion \& services. millions users ( ) , devices. ** duties:** | * available, low-latency backend , customer-facing * , * ’ , best-i"
asaniczka_c56f5224d3342b9c,kaggle_asaniczka,2024-01,Machine Learning Engineer,Tiger Analytics,unknown,7.0,llm,1131,9,3,0,1,0,0,none,14,4,7.957559681697613,0.8841732979664014,"providing , execution, , , reusable implemented production-quality , cross-functional leveraging communicate results. | ml on-going improvements. , , , cleansing, workflows, integrating / large-scale productionnvironments reporting. , , , d"
arshkon_3902360171,kaggle_arshkon,2024-04,"JAVA Fullstack Developer-AWS @ Chicago, IL - 6 Months with EXT - Hybrid Role ONLY LOCAL PROFILES",CBase Inc,unknown,5.0,llm,1118,13,0,0,0,0,1,none,14,2,11.627906976744185,0.0,"profilesposition : : , duration : ext setsnods js apisaws having - , cloudfront, , route53, db, , ec2, , , api etl/ab initio, aws redshift, aws dynamodb, db sql/nosqlexperience restful apisexperience ci/cd, teamcity, githubstrong , liaising"
linkedin_li-4385798888,scraped,2026-03,Senior Full Stack Developer,Zimmer Biomet,mid-senior,6.0,llm,1103,11,0,1,1,0,0,none,14,4,9.972801450589301,0.9066183136899365,"tied pipeline. closely algins firmware needs. utilize , c#, , , grpc, aws. ** ** | * , , maintain backend (asp.net , c#) sql databases high-performance systems. * maintain high-performance c# backend utilizing grpc low-latency systems. * no"
linkedin_li-4390811166,scraped,2026-03,Full Stack Developer,JTEC Consulting LLC,mid-senior,4.0,llm,1100,13,0,0,0,0,0,none,14,2,11.818181818181818,0.0,"** ts/sci polygraph on-site mid-senior environment. current/recent cloud-based designing implementing , , user interface. **duties include:** | * designing implementing ( , , ) * closely translate requirements user incorporate functionality"
asaniczka_79b75dfc8ebf4839,kaggle_asaniczka,2024-01,Senior Full Stack Developer,i3 Verticals,mid-senior,8.0,llm,1070,11,0,1,1,0,0,none,14,4,10.280373831775702,0.9345794392523364,", : | % comfortable back-end programming. designing , ensuring responsiveness , alongside , duties. possess expertise , j2ee, , aws, docker/kubernetes, servers, familiarity front-end , message queues, databases. duties & | maintain user ang"
linkedin_li-4397188789,scraped,2026-04,.Net Lead Developer (W2 Contract),HPTech Inc,mid-senior,12.0,llm,1070,9,1,2,1,0,2,none,14,5,8.411214953271028,0.9345794392523364,"** ** ** ** ** started ai claude tasks workflows, ** : full-stack development. requires , flows involving relational databases, \& analytics. alongside , , , applications. ** :** | * .net/sql web-based integration. * modernizing future-read"
asaniczka_51f10db3026ce30b,kaggle_asaniczka,2024-01,Senior Machine Learning Engineer,Jobot,mid-senior,5.0,llm,1066,5,5,1,1,0,0,phd,14,6,4.690431519699812,0.9380863039399625,"| exciting ! ai enablement delivering ml expertise happen. nearly cpu, gpu, tpu; biologists, , necessary ml , approaches , fine-tuned derived bioengineering. evaluating ml , types way. archaeology, debug kubeflow flyte, quickly codon , ’ , "
linkedin_li-4330460104,scraped,2026-04,"Lead, Software Engineer - PGIM Global Wealth (Hybrid, Newark, NJ)",PGIM,mid-senior,8.0,llm,1064,10,0,2,1,0,2,none,14,4,9.398496240601503,0.9398496240601504,"** ** full-stack development. ’ including , analytics. requires , flows involving relational databases, \& analytics. alongside , , , applications. ** ** * .net/sql web-based integration. * modernizing future-ready * conducting reviews. * c"
arshkon_3901396100,kaggle_arshkon,2024-04,ReactJS Developer,"Denken Solutions, Inc.",unknown,3.0,llm,1062,11,0,1,1,0,1,none,14,4,10.357815442561206,0.9416195856873822,": ( )node.jscloud developmentmicroservicesweb apiazure ( )kubernetes minimum qualifications:bachelor’ , , field.3 - 5+ , javascript frameworks.proven expertise designing implementing micro-frontend architectures.strong (html, css/scss, java"
asaniczka_0b7a445440a558b6,kaggle_asaniczka,2024-01,Principal Software Engineer - Big Data,Warner Bros. Discovery,mid-senior,8.0,llm,1050,9,1,2,1,0,0,none,14,5,8.571428571428571,0.9523809523809523,", , non-streaming , , , multi-tenant, multi-cloud platform. encompasses designing , , , ensuring , upholding governance, maintaining , enabling all. , prototyping, , experimentation, production. iterating constructing cohesive , decisively "
arshkon_3904419488,kaggle_arshkon,2024-04,Senior Software Engineer,Equifax,mid-senior,4.0,llm,1049,11,0,1,0,1,0,none,14,4,10.486177311725452,0.0,"’ demonstrate , architectures problems including , demonstrate problems deeper needed include , , , scrum troubleshooting gcp aws , , data/metrics maniacal optimizing efx maintaining , devsec, kpis , maintain , slo, slis efx , , , , up-to-d"
arshkon_3905329420,kaggle_arshkon,2024-04,Staff Software Engineer - Interactive Computing,Veritas Search Group,mid-senior,5.0,llm,1047,10,0,2,0,1,2,none,14,4,9.551098376313275,0.0,", convert jupyter notebook streamlined applications. expertise improve functionality, usability, , providing ' low/no capabilities. ' include: | - python- javascript/typescript- jupyter notebooks , ensuring top-tier notebook ' workspaces/id"
asaniczka_08cecefb08b8b5c8,kaggle_asaniczka,2024-01,Senior Software Engineer - Full Stack,Expedition Technology,mid-senior,5.0,llm,1032,13,0,0,0,0,0,none,14,2,12.5968992248062,0.0,"( ), motivated , , maintain ( ) repository ai/ml annotations entire ( ) ( ) , ; scrum , designing , capabilities open-source , end-users needs. , : | extremely , motivated, welcoming ecosystem. , including , , troubleshooting, debugging cut"
asaniczka_3666d779aad7bdf2,kaggle_asaniczka,2024-01,Principal Software Engineer - Google Cloud Platform (GCP),Dun & Bradstreet,mid-senior,2.0,llm,1024,10,0,1,2,0,2,none,14,4,9.765625,1.953125,", as-a-service (idaas) idaas solution. : | lead/designing, , vbo , , service-oriented , object-oriented programming. , , , team. systems. challenging problems projects. , methodologies, participate – requirements, , designing, , , qa’ , , f"
asaniczka_58f12ee93494112a,kaggle_asaniczka,2024-01,Senior Full Stack MEAN Developer,Superlative Technologies,mid-senior,5.0,llm,1021,10,0,2,1,0,1,none,14,4,9.79431929480901,0.9794319294809011,": minimum : obtain : security+ obtain ( suprtek) dmr applications. motivated expertise angular, , nodejs, team. , designing, , maintaining high-quality ' success. : : | , , maintain robust full-stack angular nodejs/express backend. (angular"
linkedin_li-4394677388,scraped,2026-04,Senior Software Engineer,Optum,mid-senior,7.0,llm,1017,8,2,1,2,0,0,none,14,5,7.866273352999016,1.966568338249754,"| ** ** hands-on expertise , , angular, cloud-native architectures, , azure. high-performing , contribute , , including ai/ml-driven capabilities ** ** * object-oriented industry-recommended robust * large-scale enterprise-wide * cloud-nati"
asaniczka_bf08ddf1711fc7bb,kaggle_asaniczka,2024-01,Sr. Software Engineer,Perigon,mid-senior,5.0,llm,998,7,1,1,2,1,1,ms,14,7,7.014028056112225,2.004008016032064,": ' team. ' ensuring algorithms. 5-8 , ' stranger problems. quality. expect deeply involved high-level , providing mentorship, timelines. : | : , problem-solving, ownership. & : ' offerings. , , ai capabilities. & : establish rigorous integ"
asaniczka_d1f1c5fb6cae0470,kaggle_asaniczka,2024-01,Principal Engineer I - Data,GEICO,mid-senior,4.0,llm,974,12,0,1,0,0,0,none,14,3,12.320328542094456,0.0,"high-performance, , zero-downtime , applications. friction-less maintain highest availability. , typically ranging front-end back-end between. , : | entire , , , problems enterprise-class , usability, utilize , c# object-oriented , sql, nos"
asaniczka_0f5ca8e070baf388,kaggle_asaniczka,2024-01,Machine Learning Engineer,Rockwell Automation,unknown,5.0,llm,961,8,3,1,0,1,1,none,14,5,8.324661810613943,0.0,", (mle) promote , , indicators trends. ml-based prediction capabilities detecting anomalous conditions singularities monitored efficacious alerting. , (mle) ai/ml algorithms, including , monitored, maintained, managed. identify, understand,"
linkedin_li-4383614793,scraped,2026-04,Senior / Lead Fullstack Python Engineer,CyberCoders,mid-senior,7.0,llm,960,12,0,0,1,0,0,none,14,3,12.5,1.0416666666666667,"** / ** ** :** ' / next-generation, ai-driven platforms. , ' combine hands-on , , systems. ' cross-functionally , , , , fostering excellence. ** ' ** | * high-performance, front-end * mid-level , fostering learning. * long-term maintainabil"
linkedin_li-4372949407,scraped,2026-03,Staff Software Engineer II,Thomson Reuters,mid-senior,,llm,959,13,1,0,0,0,1,none,14,2,13.555787278415016,0.0,"** ( ) – ** ’ next ai‑ , ‑ ‑ thrives ‑paced , adopts ai , enjoys closely ai bring life. ‑ , translate , seamlessly evolving ai systems. ’ users ai , ‑ interfaces. ** ’ ** | * ‑ ‑ workflows, enabling ‑ai backend services. * , ‑ , , invocatio"
linkedin_li-4277238742,scraped,2026-03,Senior Developer,ICE,mid-senior,5.0,llm,940,8,2,1,2,0,0,none,14,5,8.51063829787234,2.127659574468085,"** ** next-gen ' platform. ( ) authoritative definitions ' depends on. correctness optional; , open. enables underpins ' consequential benchmarks: , approximately % traded , lbma , used , , worldwide. , owns lbma , benchmarks. mission-criti"
linkedin_li-4388712321,scraped,2026-03,Senior Software Engineer,Wells Fargo,mid-senior,2.0,llm,928,13,0,0,0,0,0,none,14,2,14.008620689655173,0.0,"** ** , , , , ecosystem. ‑ ‑ enterprise. closely ‑ , , ‑ ongoing ensuring , , met. ** , ** * , , , debug, ‑ features. * moderately , , environments. * analyze propose grounded principles. * ‑ roadmaps. * escalation , , , including tuning. *"
asaniczka_0e66dfc0e58ec6ed,kaggle_asaniczka,2024-01,Lead/Staff Software Engineer – Front End (Bangkok based – Relocation provided),Agoda,mid-senior,3.0,llm,922,11,0,1,0,0,0,bs,14,4,11.93058568329718,0.0,"front-end including , , , , post-booking , more. ’ world. localized user include websites, , sites. front-end user integrating – user experience. evolving experimentation ; accomplish having modularized , utomating optimizing embracing data"
asaniczka_9f7ff030a0d9c669,kaggle_asaniczka,2024-01,"Lead Java Developer (Java, Kotlin, Azure)",Infogain,unknown,14.0,llm,921,11,0,0,2,0,2,none,14,3,11.943539630836048,2.1715526601520088,"summary: | expertise microservices-based kotlin | , ktor, java/j2ee azure. qualifications : | 14+ end-to-end implementations kotlin, , microservices cloud-native / paas databases, , participate , optimizing : | expertise microservices-based"
asaniczka_b92812a45250a3ca,kaggle_asaniczka,2024-01,(USA) Software Engineer III,Sam's Club,unknown,5.0,llm,914,12,0,0,1,0,2,none,14,3,13.12910284463895,1.0940919037199124,"maintaining ' club. , participate medium- large-scale reviewing requirements; translating requirements ; requested ( example, documents, requirements, ); ; conducting ; communicating ; collaborating ; troubleshooting bug-fixes; ensuring on-"
asaniczka_0f4f300602873521,kaggle_asaniczka,2024-01,Senior Fullstack Developer [NTT DATA],CareerBeacon,mid-senior,5.0,llm,898,13,0,0,0,0,1,none,14,2,14.476614699331849,0.0,"versatility including front-end capabilities back-end allows correctly communicating services. duties include joining fast-paced , estimation, , necessary and/or services. functionality prioritized methodologies, ( adjudication, , , trackin"
linkedin_li-4397418312,scraped,2026-04,Data Engineer II,Lennar,mid-senior,2.0,llm,880,11,0,1,0,1,0,none,14,4,12.5,0.0,", mid-level , contribute pipelines. contribute , etl ** ** * , , maintain etl volumes unstructured data. * retrieval , , cost-efficiency. * , , understand requirements translate * governance, , sensitive compliance. * third-party providers."
linkedin_li-4359480401,scraped,2026-04,Java Engineer High Value Payment Data Services - Vice President,Deutsche Bank,director,,llm,857,11,0,1,2,0,1,none,14,3,12.835472578763127,2.3337222870478413,"** ** ( ) , contribute , , , , bank. closely , , high-quality, cloud-enabled ’ | * , , , high-quality , end-to-end * maintain backend , , java-based , including microservices, , event-driven * ci/cd , , releases * , maintainable, testable ,"
asaniczka_688831e2b19ff355,kaggle_asaniczka,2024-01,Senior Software Engineer I,Spectral AI,mid-senior,4.0,llm,843,12,0,1,0,0,1,none,14,3,14.234875444839858,0.0,", , , , , ideally software. successfully advances team. contribute documentation written effectively setting. duties | maintaining ’ ai c#, c++ programing framework. preferred. integrating ’ sdks. implementing system. configuration, , valid"
linkedin_li-4289383619,scraped,2026-03,Senior Software Engineer - Full Stack Web,Zoox,mid-senior,8.0,llm,833,12,0,0,1,0,1,none,14,3,14.40576230492197,1.2004801920768307,"aiding , ensuring safety-critical vehicles. high-paced team. , establish , automate, needed safety-critical revolutionize century. , , safety-critical , , firmware , ranging state-of-the-art ai , highly-critical rtos components. * org , saf"
asaniczka_50cb1cbcad5fad16,kaggle_asaniczka,2024-01,Software Engineer/Developer-CO,Northstrat Incorporated,unknown,,llm,827,11,0,2,0,0,0,bs,14,3,13.301088270858525,0.0,"/ | : , on-site, requirements: existing ts/sci clearances strongly desired, workable. , , , , levels. positions vary, include front-end, back-end, opportunities. problems, , utilizing devsecops practices. duties : | workflows , , , , debug "
arshkon_3884818241,kaggle_arshkon,2024-04,Senior Software Engineer,Ziff Davis Shopping,mid-senior,,llm,825,13,0,0,0,1,0,none,14,2,15.757575757575758,0.0,"duties: | website users. translate requirements specifics requirements. , , , functionality. analyze users. cycle. projects. supervise members. documenting flowcharts, layouts, charts, diagrams documentation. advancements. budgets timelines"
asaniczka_40b921b7faf84883,kaggle_asaniczka,2024-01,Principal Software Engineer,Abbott,mid-senior,10.0,llm,822,11,0,1,0,1,1,none,14,4,13.38199513381995,0.0,", next-generation enables improve , performance. ( ) node.js team. , designing user experience. expected , ensuring equipped necessary roles. , cross-platform , ensuring user applications. back-end node.js, code. ux/ui user-friendly appeali"
asaniczka_290869a46382d681,kaggle_asaniczka,2024-01,Principal Application Engineer ( Ab-initio ),Discover Financial Services,mid-senior,6.0,llm,813,13,0,0,0,0,1,none,14,2,15.990159901599016,0.0,"develops designing, , installing determines feasibility evaluating , , requirements, , proposed manages escalates customer-impacting day-to-day management. | directs documentation. , proposals, , maintenance. analyzes determine, recommend, "
asaniczka_2c6720d5046c2eda,kaggle_asaniczka,2024-01,Software Engineer (Database Administrator),"G2 Ops, Inc.",unknown,4.0,llm,811,12,0,0,0,1,2,none,14,3,14.796547472256474,0.0,"| mysql, cassandra, , , prefer : | security+, datasys+, data+, aws , , occasionally on-site , teleworking allowed approval manager. allow elaborate. motivated, team-oriented, | penchant automation. ’ | problems , cloud-native ’ leaning mode"
linkedin_li-4397374753,scraped,2026-04,Senior Software Development Engineer,F5,mid-senior,6.0,llm,806,9,1,1,1,0,1,ms,14,6,11.166253101736972,1.2406947890818858,"plays ’ team. continually looks improve , , data-driven , decisions. participant , excellence. * , defining “ ” looks championing patterns. * end-to-end, , , , operability, leaving measurably found. * , uplifting judgement, , execution habi"
arshkon_3902355088,kaggle_arshkon,2024-04,Big Data Engineer,Empower Professionals,unknown,3.0,llm,805,12,0,0,0,1,0,none,14,3,14.906832298136646,0.0,": engineerlocation: , ( )duration: 12+ mandatory : , gcp, , requirements:bachelor' , experience.5+ engineer.3+ , , hdfs, (optional) 3+ sql scala python.2+ gradle.2+ gcp, aws azure. : gcp (bigquery, dataproc, dataflow, composer, datastream, "
