uid,source,period,title,company_name_canonical,seniority_final,yoe_extracted,text_source,text_len,tech_count,ai_count,soft_skill_count,scope_count,management_strong_count,management_broad_count,education_level,requirement_breadth,credential_stack_depth,tech_density,scope_density,excerpt
linkedin_li-4367640223,scraped,2026-04,Senior Software Engineer (Java),HireRight,mid-senior,7.0,llm,1534,20,4,0,2,0,0,none,27,4,13.03780964797914,1.303780964797914,"\& expertise tn. , , , maintain backend microservices platform. extensively \& high-performance layers, , , closely cross-functional including , , qa, management. * , , high-performance, * microservices architectures * event-driven architec"
asaniczka_5ec2bb67281018c0,kaggle_asaniczka,2024-01,Sr Principal Software Engineer,Allegiant,mid-senior,9.0,llm,3136,18,0,3,3,1,1,none,26,5,5.739795918367347,0.9566326530612245,"summary , full-stack , , maintainable systems. end-to-end, collaborating definitions , architecting implementing , ensuring deployment. closely facilitate necessary participate methodologies. participate , discussions activities. ’ comforta"
asaniczka_be89666c60802c1e,kaggle_asaniczka,2024-01,Sr Principal Software Engineer,Allegiant,mid-senior,9.0,llm,2881,18,0,3,3,1,1,none,26,5,6.24783061437001,1.0413051023950017,", full-stack , , maintainable systems. end-to-end, collaborating definitions , architecting implementing , ensuring deployment. closely facilitate necessary participate methodologies. participate , discussions activities. ’ comfortable inde"
linkedin_li-4379037398,scraped,2026-03,Full Stack Developer with Cloud and DevOps Experience,Guidehouse,unknown,,llm,1685,24,0,0,1,0,0,none,25,2,14.243323442136498,0.5934718100890207,"** ** | ** ** obtain \& (nlm) (occs) projects. involves modernizing , enabling interoperability , , hands-on python/django, ( ), node.js (express/nestjs), javascript , angular, aws, , selenium-based , mature practices. ** ** * , , maintain "
linkedin_li-4388701059,scraped,2026-03,Lead Full Stack Developer,Wells Fargo,mid-senior,4.0,llm,1041,23,0,0,1,0,0,none,25,3,22.094140249759846,0.9606147934678194,"- \& (gplt)/working ( ) gplt provides , enterprise-wide capabilities enabling terms , , , , , cost. rewrite requires hands-on end-to-end modernization. application. ** , ** * including companywide * participant companywide large-scale disci"
linkedin_li-4393030938,scraped,2026-04,Java Full Stack Engineer - React,LTM,unknown,5.0,llm,1852,16,6,0,1,0,1,none,24,4,8.639308855291576,0.5399568034557235,"** : ** ** : , , ** full-stack ai next ai-powered user challenges. entire — front-end robust back-end cutting-edge ai systems. designing, , high-impact ai-driven , , influencing * full-stack ai : , , end-to-end leveraging ( , next.js), fast"
linkedin_li-4389708542,scraped,2026-03,Java Full stack Engineer,ApTask,unknown,7.0,llm,1679,15,6,0,1,0,1,none,23,4,8.933889219773675,0.5955926146515783,": | ** ** : , , ** full-stack ai next ai-powered user challenges. entire — front-end robust back-end cutting-edge ai systems. ** ** * full-stack ai : , , end-to-end leveraging ( , next.js), fastapi ( ), , (llms) core. * ai : multi-step , , "
asaniczka_ce85c940df870c26,kaggle_asaniczka,2024-01,Principal Software Engineer I - SRE (Observability),GEICO,mid-senior,4.0,llm,1390,20,0,1,1,0,0,none,23,4,14.388489208633093,0.7194244604316546,"high-performance, , zero-downtime platforms. , co-creating , improve, existing identify problems. friction-less maintain highest availability. thrives succeeds delivering high-quality hyper-growth quickly. execution roadmap increase deliver"
linkedin_li-4371559617,scraped,2026-03,"AI Lead Engineer, Client Technology - SVP",Citigroup,mid-senior,10.0,llm,2323,12,7,1,1,0,0,none,22,5,5.165733964700818,0.4304778303917348,"** summary/position ** pragmatic ai , , ai multifaceted involves ai , actions, executing tasks minimal , contributing generative ai possess ai , agent-based , , practices. * generative ai : , , , including , , , execution modules. contribut"
linkedin_li-4394653467,scraped,2026-04,AI Platform Engineer Sr (API expert),Lockheed Martin,mid-senior,,llm,1857,14,5,1,2,0,1,none,22,4,7.539041464728056,1.0770059235325795,"** qualifications** | * : bachelor’ , , discipline. * full-stack : back-end (fastapi, flask, , ) front-end ( , angular, next.js) * api : restful api , including versioning, authentication (oauth2/oidc), documentation (openapi/swagger) * ai "
linkedin_li-4308091121,scraped,2026-03,Senior Data Engineer,LINQX,mid-senior,2.0,llm,1584,19,0,0,2,0,3,none,22,3,11.994949494949495,1.2626262626262625,"** summary:** , , operates cloud-scale ai, , ml, business. , , , , cost-efficient aws/azure. implements , , , layers. , collaborating , , governance. ** / ** * end-to-end (e.g., , , “ ” ); coordinate dependencies systems. * ; , estimate , ,"
linkedin_li-4375634245,scraped,2026-04,Sr Software Engineer,Baylor Genetics,mid-senior,6.0,llm,1524,20,0,0,1,0,1,none,22,3,13.123359580052494,0.6561679790026247,"** summary** , , maintain end-to-end backend demands front-end backend , , practices. hands-on thrives problems, , leveraging , kubernetes, c#, , databases including sql, postgresql, nosql systems. measured cohesive, end-to-end , backend, l"
arshkon_3895240684,kaggle_arshkon,2024-04,Senior Software Engineer - MFT,Equifax,mid-senior,5.0,llm,1141,20,0,0,1,0,1,none,22,3,17.5284837861525,0.8764241893076249,"mft searching , , mft platform. , cutting-edge cloud-based ’ , , operate stack. , , , , maintain, improve software. (serverless , microservices , ci/cd, infrastructure-as-code, ) existing , , toolset. participate roadmap discussions require"
linkedin_li-4391861751,scraped,2026-03,Full Stack Developer,"Eccalon, LLC",unknown,3.0,llm,2450,12,3,3,2,0,3,none,21,5,4.8979591836734695,0.8163265306122449,"** ** ** : full-time** ** : ** ** ** , , , , programs. end-to-end— front-ends next.js node.js/python aws-hosted — llm ai-assisted capabilities. closely cross-functional including , ux/ui , security-conscious, compliance-driven environment. "
linkedin_li-4384950903,scraped,2026-04,Staff Machine Learning Engineer,GEICO,mid-senior,5.0,llm,2259,12,7,0,1,0,0,none,21,4,5.3120849933598935,0.4426737494466578,"generative ai enhances enterprise. hands-on , , ml —designing , robust data/feature , production-grade mlops measurable outcomes. alongside , , , , ai-powered capabilities automate workflows, improve decision-making, user experience. contri"
arshkon_3900948764,kaggle_arshkon,2024-04,Full stack developer (SQL/NoSQL/Bigquery),Harvey Nash,unknown,5.0,llm,1508,19,0,0,1,0,0,none,21,3,12.59946949602122,0.6631299734748011,") , , ( - , , ) : summary: bigdata roadmap solution. harnesses bigdata country.at , taking next – segmentation, statistical , governance, , more. comfortable ambiguous kickass , us.job responsibilitiesdesign, , , , maintain desktop-based fr"
linkedin_li-4396015409,scraped,2026-04,Software Engineer,Equifax,unknown,5.0,llm,1060,18,0,0,1,1,0,none,21,4,16.9811320754717,0.9433962264150944,"** ** hands-on projects. ** ’ ** | * , , operate , * , , , , maintain, improve software. * (server-less , microservices , ci/cd, infrastructure-as-code, ) * existing , , toolset. * participate roadmap discussions requirements reality. * deb"
asaniczka_0edc6e37de275146,kaggle_asaniczka,2024-01,Fullstack Software Developer,Virtual Enterprise Architects,unknown,,llm,1041,20,0,0,0,0,0,bs,21,2,19.21229586935639,0.0,"vea ’ network-based threats malicious actors. crafting, , recommending , , environment. strategizing facilitate , practices. : | methodologies threats automate manual specializations include user , microservices, , architectures, databases "
asaniczka_91501595b204b859,kaggle_asaniczka,2024-01,"Principal Engineer, Full Stack",Allegiant,mid-senior,10.0,llm,2532,13,0,3,2,1,1,none,20,5,5.134281200631912,0.7898894154818326,"summary , necessities; participate , ; establish maintain facilitating workshops. closely facilitate necessary participate methodologies. minimum requirements | combination considered. 1986. check. : bachelor’ : , mis. ' preferred. minimum "
asaniczka_78f686c2dfcb6814,kaggle_asaniczka,2024-01,"Principal Engineer, Full Stack",Allegiant,mid-senior,10.0,llm,2445,13,0,3,2,1,1,none,20,5,5.316973415132924,0.8179959100204499,", necessities; participate , ; establish maintain facilitating workshops. closely facilitate necessary participate methodologies. minimum requirements | combination considered. 1986. check. : bachelor’ : , mis. ' preferred. minimum ( ) ' ; "
linkedin_li-4383871829,scraped,2026-04,"Principal, Software Engineer",CBS Sports,mid-senior,1.0,llm,2431,15,3,0,1,0,2,none,20,4,6.170300287947347,0.41135335252982314,": , : sports.com cbssports cutting-edge ai-powered deeply , , platforms. team. , , , , , groundbreaking ai scale. * ai : generative ai retrieval-augmented ( ) recommendations user personalization. * : prototyping full-cycle production-grade"
linkedin_li-4377860613,scraped,2026-03,Principal AI - Software Engineer,AT&T,mid-senior,10.0,llm,1687,11,4,1,3,0,1,none,20,5,6.520450503852993,1.7783046828689981,"assistants. ’ tasks, backend , fast-paced setting. expertise , ensuring interactions assistant. , , exciting projects. contributions ai-driven leveraging ai adk intent-less, ai agent-driven , keeping abreast field. collaborating cross-funct"
linkedin_li-4388555220,scraped,2026-03,Senior AI Full stack Engineer,Rivago Infotech Inc,mid-senior,4.0,llm,1630,10,6,2,1,0,2,none,20,5,6.134969325153374,0.6134969325153374,"** : ai **duration: ** ’ ( ) motivated \& ( \& ) \& collaborates involved (e.g., , , , , ) develops industry- problems. , maintaining pulses landscapes. primarily designing, , cutting-edge generative ai ai , , others. ai problems user exper"
linkedin_li-4385756705,scraped,2026-03,AI Python Fullstack Engineer,Rivago Infotech Inc,unknown,4.0,llm,1373,10,6,2,1,0,1,none,20,5,7.283321194464676,0.7283321194464676,"● ● identify ai/llm capabilities workflows. ● , user-centric interfaces. ● documentation: , maintainable, well- documented code. participate contribute development. ● : up-to-date generative ai learning. evaluate methodologies continuously "
arshkon_3902923533,kaggle_arshkon,2024-04,Staff Data Engineer,Splash,mid-senior,6.0,llm,1283,15,1,1,2,0,1,none,20,5,11.691348402182385,1.558846453624318,": ' , , learning. fundamentals marketing. , cross-functional ’ , , , , , , , , business. ' : closely , , , deeply understand problems , prioritize goals.collaborate , , understand identify, , scientists.enable execution roadmap , self-serve"
arshkon_3901953535,kaggle_arshkon,2024-04,"000198 - W2 Only - Data Engineer (Python, React, Hadoop & Cloud)",New Millenium Consulting,unknown,5.0,llm,1199,18,0,0,0,1,0,none,20,3,15.012510425354462,0.0,": / developerlocation: , ( – )hourly: $ ( )duration: (contract-to-hire) :minimum expertise following stacks comfortable othersmern : javascript reactjs node.js ( ) : javascript angularjs node.jslamp : javascript mysql – phplemp : javascript"
arshkon_3904423079,kaggle_arshkon,2024-04,Senior Software Engineer,Equifax,mid-senior,7.0,llm,1144,17,0,1,0,1,0,none,20,4,14.86013986013986,0.0,"’ demonstrate , architectures problems including , demonstrate problems deeper needed include , , , scrum troubleshooting gcp aws , , data/metrics maniacal optimizing efx maintaining , devsec, kpis , maintain , slo, slis efx , , , , up-to-d"
linkedin_li-4393045107,scraped,2026-04,Principle Software Engineer (Java),Sky Solutions,mid-senior,7.0,llm,2715,16,0,0,1,0,0,phd,19,4,5.893186003683241,0.3683241252302026,"** : ( )** : , ( – ) : fulltime ** :** | , openshift/ (aws), , angular/react, javascript, kafka, , , services. ** :** | * twelve-factor requirements. * ui , , achieved dialogue field. continually assess recommend improve software. * graphic"
linkedin_li-4389794138,scraped,2026-03,Principal Software Engineer,"Global CI (Global Commerce & Information, Inc.)",mid-senior,7.0,llm,2625,16,0,0,1,0,0,phd,19,4,6.095238095238095,0.38095238095238093,"** :** | , openshift/ (aws), , angular/react, javascript, kafka, , , services. * twelve-factor requirements. * ui , , achieved dialogue field. continually assess recommend improve software. * graphical user ( ) angularjs, reactjs, node js, "
linkedin_li-4342872297,scraped,2026-03,Staff Software Engineer (AI) - Full Stack,"Tailored Brands, Inc.",mid-senior,8.0,llm,1700,14,1,1,1,1,2,none,19,6,8.235294117647058,0.5882352941176471,", ' architecting high-performance, front-end back-end systems. * , , full-stack , front-end (react/next.js) back-end (java/node.js) components. * back-end ( ): java-based back-end , including microservices, , databases. , , maintainable. * "
linkedin_li-4388288721,scraped,2026-03,Full Stack Developer (Node.js & React),Optimize Search Group,unknown,5.0,llm,1493,16,0,1,1,0,2,none,19,4,10.71667782987274,0.6697923643670463,"expertise node.js team. , , , maintain cloud-based (bems) (paas), thousands devices. | **front-end ( )** maintain , high-performance user react. reusable , ( , api, similar), seamlessly back-end real-time streams. **back-end (node.js)** res"
linkedin_li-4391226467,scraped,2026-03,Full Stack Developer - AI-assisted Development,Experis,unknown,5.0,llm,1321,13,2,1,2,0,0,none,19,5,9.841029523088569,1.514004542013626,"| ** w/ ai-assisted ** , , maintain end-to-end spanning front-end , robust middle-tier , cloud-native emphasizes ai-assisted hands-on (llms) ** ** * , , maintain ui * , front-end angular vue.js * restful microservices ( ) python-based (fast"
linkedin_li-4393258704,scraped,2026-03,Advanced Software Engineer- Full Stack Cloud Developer,Honeywell,unknown,8.0,llm,1308,15,0,1,2,0,0,none,19,4,11.46788990825688,1.529051987767584,"engineer- , , maintain end-to-end cloud-based architectures. cross-functional robust, , needs. requires expertise front-end back-end , proficiency , leveraging problems. ** ** | ** ** * : | , user-friendly front-end (mainly reactjs) back-en"
asaniczka_65da6d6f608bbfd1,kaggle_asaniczka,2024-01,Senior Software Engineer,Wingbrace,mid-senior,5.0,llm,1301,14,0,2,1,1,0,none,19,5,10.760953112990007,0.7686395080707148,"| high-impact solvers. client-facing, fast-paced, wide-ranging, challenging. requires mixture , , hands-on , problem-solving, skills. , requirements , capabilities ’ wingbrace. , implementing , front-end user calling back-end restful implem"
asaniczka_9c6b3ea1fa0b086e,kaggle_asaniczka,2024-01,Sr. Full Stack Engineer - Intelligent Process Automation,Columbia Sportswear Company,mid-senior,3.0,llm,1288,15,1,1,1,0,1,none,19,5,11.645962732919255,0.7763975155279503,"' , do. ’ develops manages ( ) enables manner. ensures ’ brands. , , , , , , area. ensures , , , , , maintainability, , compatibility throughout. advances ' , , , squad. adopts improve delivery. , , refine , mind. ’ analyze, , microservice-"
linkedin_li-4374332298,scraped,2026-04,Principal Software Engineer,"Solera Holdings, LLC.",mid-senior,15.0,llm,1286,15,1,0,1,1,1,none,19,5,11.66407465007776,0.7776049766718507,"' pragmatic, hands-on done. ' spend broader team. thrives modernizing , ai-assisted , ' afraid sleeves ' contribution mentorship, review. real-time on-premises migrate cloud-based paas ai-powered ( , , claude, ) workflows end-to-end consump"
linkedin_li-4223779562,scraped,2026-04,Lead Software Engineer,GTN Technical Staffing,mid-senior,7.0,llm,1282,15,0,1,2,0,2,none,19,4,11.700468018720748,1.5600624024960998,", understand user , , high-quality demands. thrives background. * , , high-quality, maintainable, full-stack node.js, , javascript/typescript. * translate wireframes , , reusable javascript/typescript, html \& css. * restful node.js, javasc"
arshkon_3901953549,kaggle_arshkon,2024-04,"NMC_000198 - W2 - Data Engineer (React, Python, Hadoop, Cloud))",New Millenium Consulting,unknown,5.0,llm,1218,17,0,0,0,1,0,none,19,3,13.957307060755337,0.0,": / developerlocation: , ( – )hourly: $ ( )duration: (contract-to-hire) must-to-have: ( )minimum worked structured/unstructured datasets beforebig (hadoop, , , kafka, airflow/oozie, bigquery/presto/impala )minimum expertise inone following "
linkedin_li-4384845865,scraped,2026-04,Senior Software Engineer,ZoomInfo,mid-senior,,llm,1137,19,0,0,0,0,0,none,19,1,16.710642040457344,0.0,"| *** *** , , high-scale , , supplying customers. possess robust proficiency **node.js** , **typescript** , html, , coupled hands-on jest frameworks. ** ' ** | * , , microservices rest/ graph-ql node.js/typescript (nest-js ) * translate req"
arshkon_3905335078,kaggle_arshkon,2024-04,Sr. Software Engineer,General Motors,mid-senior,5.0,llm,1038,15,0,1,2,0,1,none,19,4,14.45086705202312,1.9267822736030829,", user customers. designing appealing user user satisfaction. user , feedback, user-friendly implementations. expertise user-centered ui , , usability , user experience. : end-to-end combination front-end back-end : , , sql , db, , applicat"
linkedin_li-4393483075,scraped,2026-04,full stack java developer,Excelon Solutions,unknown,10.0,llm,953,14,1,1,2,0,0,none,19,5,14.690451206715634,2.0986358866736623,"** : ( \ )** ** :** | \ ** summary:** | ** ** \ designing, , maintaining applications. expertise ** backend ** | ** ** , **cloud-based microservices architectures** ** :** | * , , maintain end-to-end ** ( )** * high-performance **restful **"
arshkon_3885844769,kaggle_arshkon,2024-04,Frontend Software Engineer (Contract) (Hybrid) – 4315,HIRECLOUT,unknown,3.0,llm,948,13,1,2,1,1,0,none,19,6,13.713080168776372,1.0548523206751055,"utilize requirements , , user-friendly reusable controls. translating intricate requirements detailed design. proposed existing improved reusability scalability. facilitate participate discussions regarding existing goals. documents, , unit"
asaniczka_1772d911512002cd,kaggle_asaniczka,2024-01,"Lead Application Developer - NodeJS, React and API's",CLA (CliftonLarsonAllen),unknown,10.0,llm,890,16,0,0,0,2,1,none,19,3,17.97752808988764,0.0,"currently , , web-based frameworks. goals. microservices, azure/aws. c#.net, , react.js, angularjs, node.js, html, , xml, sql, webapi, javascript. ' : existing , , , debugs, documents, maintains, modifies complexity, risk. investigate, anal"
linkedin_li-4387527933,scraped,2026-03,Java Full Stack Developer with AWS/F2F Mandatory,Key Business Solutions,mid-senior,10.0,llm,2490,14,1,1,1,0,0,none,18,5,5.622489959839357,0.40160642570281124,"aws/f2f mandatory ; duration: ** ** ’ hands-on , cloud-native applications. ’ , , \ , \ , angular , aws \ , emphasis (postgresql/aurora) ’ closely , , , qa high-quality environment. genai ( , claude sonnet) graph ( neptune/graph ) plus. ’ |"
linkedin_li-4388334955,scraped,2026-03,AI Data Engineer - Senior Consultant,Deloitte,mid-senior,4.0,llm,2432,10,5,0,1,0,2,phd,18,5,4.1118421052631575,0.41118421052631576,"ai operate , , genai ai analytics. ai ( ingestion, curation, governance, ) ai (end-to-end , , non-functional requirements), closely , science/ml, , , , ai hands-on delivery-oriented: , real-time inference, llm claude-, gpt/codex-, gemini-cl"
linkedin_li-4392370783,scraped,2026-03,AI Engineer - (Remote - US),ICF,unknown,3.0,llm,2020,10,4,1,2,0,1,none,18,5,4.9504950495049505,0.9900990099009901,"** ** ai ai real-world workflows. sits ai ' end-to-end problems, back-end polished, user-facing front-end experiences. , comfortable picking needed ' javascript , dashboard, low-code apps. ' , , interpersonal effectively non-technical stake"
linkedin_li-4375829390,scraped,2026-04,"Senior AI Engineer - GenAI/ML, Aladdin Engineering - Vice President",BlackRock,director,8.0,llm,2004,8,5,1,2,0,1,ms,18,6,3.992015968063872,0.998003992015968,"ai (genai/ml), ’ example — architecting, , generative ai improve , user , post-trade operations. ’ enterprise-scale ai-enabled , governance, practices. enjoys staying , , (tool-using ai ) ml — fostering improvement. ** ( )** * ’ largest inv"
linkedin_li-4358764091,scraped,2026-04,"AI-Augmented Full Stack Engineer, Aladdin Engineering, Post Trade Accounting - Vice President",BlackRock,director,7.0,llm,2002,10,4,1,1,0,2,bs,18,6,4.995004995004995,0.4995004995004995,", problems. \& provides ' including \& operates. including calculation , , , reconciliation, management. ** ** **ai-accelerated \& :** , , , maintain backend, leveraging ai-powered (e.g., , , refactoring) dramatically solutioning maintainin"
asaniczka_b8c663521db79573,kaggle_asaniczka,2024-01,DotNet Developer Sr.,"Medline Industries, LP",mid-senior,10.0,llm,1849,13,0,1,2,1,2,none,18,5,7.030827474310438,1.0816657652785289,"– angular/ / c# /.net full-stack team. designing implementing , angular, typescript, c#, management. , designing , evaluating applications. defining, implementing, , functionality, ’ needs. self-motivated, problems, , constantly improve ski"
linkedin_li-4389275077,scraped,2026-03,Senior Software Developer,PTR Global,mid-senior,10.0,llm,1616,14,1,1,1,0,0,none,18,5,8.663366336633663,0.6188118811881188,"**duration:** | \ hands-on contribute , cloud-native applications. designing, , optimizing \ , \ , angular , aws \ , (postgresql/aurora) involves , , , qa environment. genai ( , claude sonnet) graph ( neptune/graph ) plus. ** :** | * micros"
linkedin_li-4321183200,scraped,2026-04,MarTech Senior Software Engineer,Realtor.com,mid-senior,5.0,llm,1609,15,0,1,1,0,1,none,18,4,9.322560596643878,0.6215040397762586,"** ’ :** | ’ , , operate backend channels ’ — , measure, campaigns. , observability, millions users messages time. * , , operate backend , observable, cost-efficient, aws. * kafka ( ) , , real-time cases. * contribute (e.g., kafka/msk) work"
linkedin_li-4390743629,scraped,2026-03,Software Engineer – Azure Databricks & Agentic AI,Frame Data & AI,unknown,3.0,llm,1451,10,7,0,0,0,0,none,18,3,6.891798759476223,0.0,"** ** ' "" "" — ’ , , loops ai useful. ’ questions execute tasks ecosystems. ** ’ ** * ** :** | multi-agent **langgraph, crewai, autogen** automate , multi-step processes. * ** execution:** | , ai-integrated (react/next.js) robust microservic"
asaniczka_4120290019af2896,kaggle_asaniczka,2024-01,Sr. Software Developer,Jobot,mid-senior,8.0,llm,1308,17,0,0,0,0,1,none,18,2,12.996941896024465,0.0,", full-stack php/react experience. , best-in-class team. restful , implementing , modules, postgresql. ( ) postgresql. , high-load client-side , requirements, maintain modules, ones. javascript/typescript, reactjs, preprocessors sass/scss l"
arshkon_3904952118,kaggle_arshkon,2024-04,Cloud Software Engineer,Dice,unknown,1.0,llm,1207,14,0,2,0,1,1,none,18,4,11.5990057995029,0.0,", next services. ' : clients.write craftsmanship.debug troubleshoot process.product rotation basis.opportunity following stacks: , spring/springboot, microservices, , ci/cd, , , , ( platform/azure/aws), , nextjs, sql, , json, swagger/openap"
asaniczka_4c1f01a9d93fead0,kaggle_asaniczka,2024-01,Sr. Front end Developer,Ekodus,mid-senior,10.0,llm,1192,16,0,0,0,0,0,phd,18,3,13.422818791946309,0.0,": duration: ; extensions : | stencil js, storybook, sass, typescript, , , , : | requirements, front-end stencil js, sass, typescript, components. pocs templates storybook isolation, speed. microservices adapting twelve-factor , restful bach"
arshkon_3904391473,kaggle_arshkon,2024-04,Cloud Software Engineer,Ford Motor Company,unknown,1.0,llm,1087,15,0,2,0,0,1,none,18,3,13.799448022079117,0.0,", next services. clients.write craftsmanship.debug troubleshoot process.product rotation basis.opportunity following stacks: , spring/springboot, microservices, , ci/cd, , , , (gcp/azure/aws), , nextjs, sql, , json, swagger/openapi, cucumbe"
linkedin_li-4388658640,scraped,2026-03,Full-Stack AI Engineer (React / Python),Tata Consultancy Services,unknown,,llm,808,11,6,0,1,0,1,none,18,3,13.613861386138614,1.2376237623762376,"summary full-stack ai team. end-to-end state-of-the-art ai/ml models. thrives ui/ux underlying complexity pipelines. | * : , user ( \ ) typescript. * ai : ai-driven llm-powered chatbots, (retrieval-augmented ) , recommendation engines. * ba"
asaniczka_90b0dc3209143d91,kaggle_asaniczka,2024-01,Python Developer,Matlen Silver,unknown,5.0,llm,773,13,2,1,1,0,1,none,18,5,16.81759379042691,1.2936610608020698,"| , team. , , maintaining applications. cross-functional , , data-driven requirements. : | - , , maintain data-driven language. - cross-functional data-driven - , , well-documented code. - debug functionality. - participate feedback. - etl "
asaniczka_d0aafdb4246a9f61,kaggle_asaniczka,2024-01,Python Developer,Vantage Point Consulting Inc.,unknown,5.0,llm,769,13,2,1,1,0,1,none,18,5,16.90507152145644,1.3003901170351104,"team. , , maintaining applications. cross-functional , , data-driven requirements. : | - , , maintain data-driven language. - cross-functional data-driven - , , well-documented code. - debug functionality. - participate feedback. - etl work"
asaniczka_db9b422339811769,kaggle_asaniczka,2024-01,Software Development Engineer,TALENT Software Services,unknown,5.0,llm,751,13,2,1,1,0,1,none,18,5,17.310252996005325,1.3315579227696406,"summary: team. , , maintaining applications. cross-functional , , data-driven requirements. responsibilities/accountabilities: | , , maintain data-driven language. cross-functional data-driven , , well-documented code. debug functionality. "
asaniczka_91ac0bf3c503e2b3,kaggle_asaniczka,2024-01,Senior Data Engineer,AllianceBernstein,mid-senior,,llm,2308,14,0,2,1,0,3,none,17,3,6.065857885615252,0.43327556325823224,"(“fiit”) , , , , backoffice operations. understand providing re-engineer conditions. ingests egresses up-stream down-stream systems. ( ), allowing processes. constantly needs. – designing, implementing, maintaining, tuning etl elt , airflow"
