uid,source,period,title,company_name_canonical,seniority_final,yoe_extracted,text_source,text_len,tech_count,ai_count,soft_skill_count,scope_count,management_strong_count,management_broad_count,education_level,requirement_breadth,credential_stack_depth,tech_density,scope_density,excerpt
linkedin_li-4376317147,scraped,2026-04,"Senior Backend Java Engineer, Aladdin Engineering - Trading, VP",BlackRock,director,7.0,llm,1445,10,1,1,1,0,0,bs,15,6,6.920415224913495,0.6920415224913494,"' called aladdin. used internally externally institutions. combines , , decision-making thousands users worldwide. collaboratively next , , firms. trillions millions instruments. calculations millions thousands users ! ** , ** ** include** "
asaniczka_c512236c1e8f0719,kaggle_asaniczka,2024-01,Sr. Staff Software Engineer,Generac Grid Services,mid-senior,10.0,llm,1384,9,0,3,1,1,1,none,15,5,6.502890173410405,0.7225433526011561,"| | ? , direction. iterate quickly , including bring production. expertise , , , large-scale platforms. interpersonal understand requirements systems. , , belief data-driven products. understand systems. , real-world problems bringing creat"
asaniczka_7f9f1732e235069b,kaggle_asaniczka,2024-01,Senior Staff Software Engineer,Generac Power Systems,mid-senior,10.0,llm,1374,9,0,3,1,1,1,none,15,5,6.550218340611353,0.727802037845706,", direction. iterate quickly , including bring production. expertise , , , large-scale platforms. interpersonal understand requirements systems. , , belief data-driven products. understand systems. , real-world problems bringing create. des"
asaniczka_d7524f8470386dea,kaggle_asaniczka,2024-01,Sr. Software Engineer,Guild Mortgage,mid-senior,5.0,llm,1366,12,0,2,0,0,2,none,15,3,8.784773060029282,0.0,"summary plays important tasks ’ functions. primarily , , , designing, ' leading-edge following practices. | contribute necessary requirements manageable plans. contribute feedback concerning management. contribute recommendations , includin"
linkedin_li-4368050644,scraped,2026-03,Data Engineer III,Crunchyroll,unknown,5.0,llm,1325,10,2,1,1,0,1,none,15,5,7.547169811320755,0.7547169811320755,", presenting millions anime world. provides , ensuring fans. , designing, implementing, optimizing , ensuring business. cross-functional eventing , teams. expertise % , , , optimizing environments. ** ** * , maintainable, well-documented ap"
linkedin_li-4367073588,scraped,2026-04,Principal Software Engineer - Commerce,Early Warning®,mid-senior,1.0,llm,1257,10,0,1,3,0,1,none,15,4,7.955449482895784,2.386634844868735,"hands-on, involved setting ensuing outputs teams. providing initiatives. continuously keeping abreast finding bring organization. * , descriptions roadmaps. * : expertise , team. members. * takes * conducts presentations small-to-medium gro"
arshkon_3901378179,kaggle_arshkon,2024-04,Senior Software Engineer (NodeJS +.Net),Capillary Technologies,mid-senior,3.0,llm,1254,13,0,0,0,1,2,none,15,3,10.36682615629984,0.0,"existing products. large-scale skills. , back-end , including node.js , server-side , dev-ops initiatives. additionally, , needs. , expected , ensuring adhering delivering high-quality closely deliverables completed on-time highest standard"
linkedin_li-4383257789,scraped,2026-04,"Software Engineer (Go, Typescript & PHP) Enterprise Supervision",Tyler Technologies,unknown,3.0,llm,1237,11,1,2,0,0,2,none,15,4,8.89248181083266,0.0,"large-scale used states. focuses maintaining, , modernizing primarily , typescript, mysql, contributing gradual introduction go-based services. stabilizing existing , , , service-oriented ** ** | * maintain large-scale , typescript, mysql. "
linkedin_li-4380180876,scraped,2026-03,SAAS Software Developer - Onsite,NTT DATA North America,mid-senior,5.0,llm,1219,11,2,1,0,0,1,none,15,4,9.023789991796555,0.0,", ’ ' b2c , , , customer-centric platforms. * \& * maintain b2c products. * , , ux understand requirements estimate timelines. * communicate , blockers, delays proactively team. * contribute processes. * generative ai workflows. * \& * , ma"
arshkon_3896133028,kaggle_arshkon,2024-04,Staff Frontend Developer,Contrast Security,mid-senior,10.0,llm,1216,14,0,0,0,0,0,none,15,2,11.513157894736842,0.0,"front-end wants full-stack developer. enthusiastic , typescript, , reactjs interested pursuing life-changing delivery. , , , , maintainability. dashboard capabilities runtime ’ posture. providing improve , findings, reporting. include next "
linkedin_li-4312073986,scraped,2026-03,"Senior Software Engineer, Applied AI",Lila Sciences,mid-senior,7.0,llm,1188,10,1,2,1,0,0,none,15,5,8.417508417508417,0.8417508417508418,"| ** ** , backend , , ai , data-driven applications. ’ backend , ensuring seamlessly cutting-edge ai retrieval-augmented ( ), ai, (llm) integration. thrives ai— production-grade real-world discovery. * ai : backend ai , including llms, , fr"
linkedin_li-4394655045,scraped,2026-04,Web Application Developer with Security Clearance,"Agile5 Technologies, Inc.",unknown,5.0,llm,1175,13,0,0,1,0,0,none,15,3,11.063829787234043,0.851063829787234,"searching , , developer. : , , maintain , high-performance applications. focuses ( ), requirement ui/ux back-end deployment. problem-solver thrives , maintainable, code. duties: * full-stack : robust front-end (e.g., , angular, vue.js) back"
arshkon_3903451995,kaggle_arshkon,2024-04,NodeJS Backend Developer,Diamondpick,mid-senior,3.0,llm,1131,13,0,1,0,0,1,none,15,3,11.494252873563218,0.0,"nodejs backend developerbentonville, arexperience: 3+ yrs mid- senior-level node.js backend team. javascript-based , backend development. closely high-quality requirements expectations. javascript-based , including implementing following co"
arshkon_3905874827,kaggle_arshkon,2024-04,Developer III,Dice,unknown,5.0,llm,1116,13,0,0,0,0,1,bs,15,3,11.64874551971326,0.0,"summary: e-strategy, quote api initiatives. digitization bringing self-service customers. ' needs. : : 5pm : bachelors : node.js, http, , nosql, technologies.work minimum support.design existing node.js.proficient versioning , git/svn. sets"
asaniczka_ebffc6158cd64ed6,kaggle_asaniczka,2024-01,Senior Software Developer,Experis,mid-senior,5.0,llm,1109,13,0,0,1,0,2,none,15,3,11.722272317403066,0.9017132551848512,"duration - softwar , ' close-knit , , capabilities expertise , expertise api , microservices, , nosql rdbms storage. next-generation, systems. , , delivering role. azure/aws & backend role. collaborates requirements produces high-level deta"
linkedin_li-4392019352,scraped,2026-03,Senior Software Engineer (Backend APIs/Platform),T-Mobile,mid-senior,4.0,llm,1102,12,0,0,1,1,2,none,15,4,10.88929219600726,0.9074410163339383,"in-house capability. foundational delivering , api-based platforms. , existing , , , , processes. closely , , , business-critical requires hands-on , , , execution fast-evolving environment. ** :** * , , maintain boot-based microservices le"
linkedin_li-4360536624,scraped,2026-03,Senior Backend Engineer (Go),VideoAmp,mid-senior,7.0,llm,1072,9,2,1,2,0,1,none,15,5,8.395522388059701,1.8656716417910448,"| **backend api ** , - , , measure deduplicated audiences linear environments. ’ production-caliber api : , , , , observability, systems. , , measure , ’ closely , , , services. ’ self-starter, detail-minded, , thrives high-ownership enviro"
asaniczka_17391b39dfd67130,kaggle_asaniczka,2024-01,Software Engineer III,HBK - Hottinger Brüel & Kjær,unknown,3.0,llm,1059,12,0,2,0,0,1,none,15,3,11.331444759206798,0.0,"collaborating closely colleagues functions. combine expertise , durability, modelling , include model-driven analytics. joining , , configuration alongside , approaches. | configuration, presentations , collaborating understand convert user"
linkedin_li-4364760911,scraped,2026-03,Sr Staff IT Software Engineer - IT Go-To-Market & Customer Experience,Palo Alto Networks,mid-senior,3.0,llm,1047,10,2,1,1,0,1,none,15,5,9.551098376313275,0.9551098376313276,"go-to-market platform. custom-built , including microservices ai-powered , engaging practices. , , , high-quality, fast-paced , adapting * , teams. * establish environment. * , including determining requirements schedules. * , , go-to-marke"
asaniczka_5c7f2040562a7d8c,kaggle_asaniczka,2024-01,Java Application Architect,Labcorp,mid-senior,10.0,llm,1040,11,0,0,1,2,1,none,15,4,10.576923076923077,0.9615384615384616,"expert-level industry. formed contribute implementing (restful ) applicant challenged cutting-edge java/linux-based virtualized , (iaas) applicant workflows prospective , including , , , coaching/mentoring adopting platforms. teams. include"
linkedin_li-4376363741,scraped,2026-04,Senior Staff Software Engineer - Global Commercial Services,American Express,mid-senior,8.0,llm,1024,11,0,0,3,0,2,none,15,3,10.7421875,2.9296875,"motivated , self-led team. , domains, influencing , , ensuring , high-quality real-time platform. high-impact suited cross-functional , comfortable ambiguity, scale. * , ensuring , maintainability, reliability. * , , , development. * , , ex"
linkedin_li-4362861754,scraped,2026-03,Senior Software Engineer – R&D,Munters,mid-senior,,llm,1017,12,1,0,0,1,1,bs,15,4,11.799410029498524,0.0,"** summary** | ** ** r\& team. motivated robust, applications. high-quality used base. encourages , , best-practice , ongoing leadership. ** ’ ** | * backend / asp.net , prototypes , observable, production-ready services. * pocs workflows s"
linkedin_li-4373413436,scraped,2026-04,Senior Software Engineer - Full stack Typescript,Commerce,mid-senior,5.0,llm,1015,12,1,0,1,0,2,none,15,4,11.822660098522167,0.9852216748768473,"| * * typescript makeswift broader designing, prototyping, frontends. ’ makeswift’ , capabilities, third-party platforms. ** ’ ** | * onboarding flows makeswift , closely collaborating prototypes * end-to-end makeswift third-party * measure"
linkedin_li-4387990487,scraped,2026-03,Lead Data Engineer,AI AXISS INC,mid-senior,5.0,llm,1005,14,0,0,0,0,1,none,15,2,13.930348258706468,0.0,"** : ** ** : whippany, ** **in-person mandatory** client-facing | ** ** expertise postgresql , hands-on java-based microservices api development/consumption. designing , robust , closely – model. ** summary** | * client-facing required. * e"
asaniczka_d10053dbb3735f9d,kaggle_asaniczka,2024-01,Senior Backend Engineer,CGI,mid-senior,8.0,llm,1004,12,0,1,1,0,2,none,15,4,11.952191235059761,0.9960159362549801,"| hands-on expertise team. back-end scrum , closely evaluate features. , designing, , , off-the-shelf software. including , , , roadmap. ’ priorities. evolves. , , important. back-end self-motivated , time-management, interpersonal skills. "
linkedin_li-4359113643,scraped,2026-03,Principal Software Engineer,BuildOps,mid-senior,,llm,988,12,0,0,2,0,0,bs,15,3,12.145748987854251,2.0242914979757085,", , , objectives highest level. , industry. continual refinement roadmap, defining approaches platformization , ingestion , , financial/accounting systems. , gaps ensuring strategy. ** ’ ** | * contributions * proactively identify conflicts"
linkedin_li-4397198551,scraped,2026-04,Senior Machine Learning Engineer,Logisoft Technologies Inc,mid-senior,13.0,llm,964,8,5,0,1,0,0,none,15,4,8.298755186721992,1.037344398340249,": \ (mandatory) : : ** , , initiatives. , delivering production-grade ml , ensuring standards. requires hands-on , mlops expertise, experience. **ml \& ** * , , (classification, regression, , forecasting) * , , tuning, * , , **mlops \& prod"
asaniczka_ef3f5e394434edf9,kaggle_asaniczka,2024-01,Senior .Net Developer,Polar IT,mid-senior,,llm,942,14,0,0,0,1,0,none,15,2,14.8619957537155,0.0,"( ) | 8+ 1-2+ aws bachelor’ field. ’ | aws platform. , , ranging , restful/graphql api’ , & , backend sql databases. translate requirements, understand , responsibly systems. tasks independently adhering deadlines. collaboratively , , , ’ ,"
asaniczka_c72e1e5245a80154,kaggle_asaniczka,2024-01,Software Engineer- Java (Hybrid),Luca Talent,unknown,,llm,922,12,0,2,1,0,0,none,15,3,13.015184381778742,1.0845986984815619,"backend engineer- - ai ai revolutionize workforce. exciting ai , backend engineers. unfortunately, sponsorship position. | – , , , , end-to-end & translating requirements detailed terms , modules, algorithms proposed solution. existing reus"
linkedin_li-4393483086,scraped,2026-04,Senior Frontend Developer,Hire'in Solutions,mid-senior,3.0,llm,919,13,0,1,0,0,1,none,15,3,14.145810663764962,0.0,"**frontend/full-stack ** ** / full-stack – next.js, node.js \& graphql** ** :** | * – * \ next.js * hands-on delivering production-grade node.js graphql server-side rendering ( ), ( ), api-driven architectures node.js graphql. comfortable ,"
asaniczka_ad0cdf883c8c2083,kaggle_asaniczka,2024-01,"Lead / Staff Full Stack Software Engineer (Bangkok based, relocation provided)",Agoda,mid-senior,7.0,llm,910,11,0,1,1,0,0,bs,15,5,12.087912087912088,1.098901098901099,"products. front-end including , , , , post-booking , more. localized user platform. include websites, , sites. end-to-end including user , , backend , systems. accomplish having , ci/cd , modularized approach. next strives , , skills. / con"
linkedin_li-4385796696,scraped,2026-03,Junior AI/ML Engineer (Remote),FocusKPI Inc,entry,,llm,902,8,6,1,0,0,0,none,15,3,8.869179600886918,0.0,": (full-time) : ai/ml ai chatbot system. ai databases, , decision-making. hands-on llm-based chatbot/agent , including prediction integrating workflows. client-facing requiring , , fast-paced environment. | * ai chatbot/agent * llm-based un"
linkedin_li-4382521569,scraped,2026-04,Senior Software Engineer - AI Platform,Hinge Health,mid-senior,5.0,llm,894,11,2,0,1,0,2,none,15,4,12.304250559284116,1.1185682326621924,"** ** providing , evidence-based ( ) pain. , ai intelligence. ’ ai team. , ’ contribute ai ’ ai workflows. enjoy , owner-operator production. , , node.js, typescript, , nestjs, graphql, , aws, postgres, , , redux. trunk-based ci/cd, securit"
linkedin_li-4379200248,scraped,2026-03,Senior Software Engineer - Full Stack,U.S. Bank,mid-senior,5.0,llm,889,14,0,0,0,0,0,none,15,2,15.748031496062993,0.0,", , , experiences. self-motivated organization. takes artifacts produced adhering minimal experience. principles. ** :** | * designing, , , maintaining * takes consistently production-ready testable * consistently adhering ; considers , sys"
arshkon_3886847226,kaggle_arshkon,2024-04,Senior Frontend Engineer,WeTravel,mid-senior,,llm,881,12,0,1,2,0,0,none,15,3,13.620885357548241,2.2701475595913734,": : bence crafting user interfaces. possess in-depth , , , you. , cross-functional 9-10 , delivering cutting-edge effectively , participating end-to-end lifecycle. microservices intricate challenges. closely backend seamlessly user-facing s"
asaniczka_5a85f9e7bb90a7dd,kaggle_asaniczka,2024-01,"Senior Manager, Software Engineering - Full Stack - Data Ventures",Walmart Data Ventures,mid-senior,12.0,llm,837,8,0,1,1,3,1,ms,15,6,9.55794504181601,1.1947431302270013,"summary... ' do... , , 10+ / engineering. delivering capabilities products. ' | , high-performing team. technically. involved required. long-term roles. ( ) , ( ) , , bengaluru maintain geography delivering globe. , you. ' bring | - b.e/b.t"
arshkon_3800272386,kaggle_arshkon,2024-04,Data Science Software Engineer,Sovrinti,unknown,2.0,llm,811,12,0,0,1,0,1,bs,15,4,14.796547472256474,1.2330456226880395,", , self-starter brings , (dsda) contribute used (bess) seeing growth. closely cross-functional requirements, , , participate , update stakeholders. , , , cloud-based used industry. features. documentation skills. , python-based development"
linkedin_li-4390294099,scraped,2026-03,Rockstar Full Stack Software Engineer (2+ years - Senior Level),Black Cape,mid-senior,2.0,llm,786,12,2,0,0,0,0,none,15,3,15.267175572519085,0.0,"** :** | ( \ - ) ** :** | ts/sci ***** ****** *** citizenship issued , you. requirement job.*** * ( ) ( ) accomplish * cloud-native full-stack , , capabilities * ! engineer-led needs. , repeatable , , approaches frequent users bring , integ"
asaniczka_aaa29b7a6593786d,kaggle_asaniczka,2024-01,Lead Full Stack Cloud Engineer,CVS Health,mid-senior,5.0,llm,784,14,0,0,0,0,0,none,15,2,17.857142857142858,0.0,"summary | enterprise/web/cloud application. , modify, , , , , microservices user react/angular, high-complexity, high-performance browser , including , , optimization. discussions providing , , restful api java/python containerize api gke. "
asaniczka_cb3bac76d7cec31e,kaggle_asaniczka,2024-01,Senior Software Architect,PlanHub,mid-senior,10.0,llm,696,10,1,1,2,0,1,none,15,5,14.367816091954023,2.8735632183908044,"& , requires full-stack , , , javascript, , html, xml, xslt, json, third-party , , , databases angular, laravel, , jquery, , , mysql aws cloud. tasks include , prototyping , re-architecting functionality address , , , , , , code. | end-to-e"
linkedin_li-4397175999,scraped,2026-04,Senior Full Stack Engineer,Fidelity Investments,mid-senior,5.0,llm,695,12,0,1,1,0,1,none,15,4,17.26618705035971,1.4388489208633093,"** ** | ** full-stack ** ** ** , user underlying needed presence. ’ entire , taking , , teams. * angular , rxjs, redux/ngrx typescript environment. * willingness , ios * , architectures (micro-frontend, , module ), used websites * , ci/cd p"
asaniczka_28cc0fba10409720,kaggle_asaniczka,2024-01,"Data Engineer, LLM",Genentech,unknown,1.0,llm,667,10,0,1,2,0,0,bs,15,5,14.992503748125937,2.998500749625187,"molecule system. ’ success. , problem-solving, modeling. closely ml researchers end-to-end workflows including , interfacing (gred) cutting-edge , , , , closely cross-functional gred problems , including analyzing algorithm issues. gred for"
linkedin_li-4369823449,scraped,2026-03,Principal Cloud Engineer,AbbVie,mid-senior,8.0,llm,2455,10,1,0,1,1,0,none,14,5,4.0733197556008145,0.4073319755600815,"** ** , aws bts. hands-on , , , enterprise-scale aws , implementing cloud-native architectures, , ai-driven , regulated environment. ’ example—delivering robust, , aws — ’ transformation. ’ : * , , documenting reuse. * aws-based , api , , ,"
linkedin_li-4390983142,scraped,2026-03,Python developer with network automation,Pull Skill Technologies,unknown,,llm,2388,14,0,0,0,0,1,none,14,1,5.8626465661641545,0.0,"** : ** ** experience.** ‑ ‑ aws, workloads kubernetes, ‑ ‑ configuration‑ ‑ gitops. , observable, , closely and/or teams. performed | * , , maintain microservices , routing, , control-plane services. * dashboards (e.g., angular typescript)"
asaniczka_0ac3213f3ce99711,kaggle_asaniczka,2024-01,Senior Software Engineer,Luminator Technology Group,mid-senior,5.0,llm,2126,11,0,0,2,0,2,none,14,3,5.174035747883349,0.940733772342427,": | mgr. : | % positions supervised: | collaborating mset design. roadmap workflows. utlizes capabilities navigates roadmaps customers. additionally, provides mset effectively encoding adequate mset base. effectively, problems, willing hand"
asaniczka_b09db40d1af338d8,kaggle_asaniczka,2024-01,Software Development Engineer III,GM Financial,unknown,4.0,llm,2020,11,0,2,0,0,2,none,14,3,5.445544554455446,0.0,"(sde) contributes scrum team. specialization, participate development. adaptable knowledgeable domains enables gaps commitments. sde devsecops utilize capabilities demands customers. , intellectually implementing cutting-edge capabilities s"
arshkon_3898168823,kaggle_arshkon,2024-04,"Full Stack Java Developer @ Fort Worth, TX - 9 Months with EXT - Hybrid Role ONLY ON W2 WITH IN-PERSON INTERVIEW",CBase Inc,mid-senior,5.0,llm,1960,12,0,0,0,0,0,bs,14,3,6.122448979591836,0.0,"w2hybrid glider ( , , angular,& junit) : : , ( )duration : ext : , ,h1-b : | - 2+ - proficiency - proficiency demonstrated following : j2ee : , jsp, , jaxb, jdbc, ejb persistence : hibernate, , object/relational , query tuning cloud-based :"
asaniczka_ac4066913d821c97,kaggle_asaniczka,2024-01,Principal Software Engineer (QA and Test Automation),Safran,mid-senior,5.0,llm,1867,13,0,0,0,0,0,none,14,2,6.963042313872522,0.0,"summary | qa , cross-disciplinary in-flight (ife) applying , including on-wing off-wing , software. closely inter-disciplinary participate , , , , ifec methodologies. self-starter, , , , environment. duties : | establish procedures measure "
arshkon_3903445676,kaggle_arshkon,2024-04,AI Engineer/Architect,Hyperion Technologies LLC,mid-senior,5.0,llm,1863,4,4,3,1,1,2,none,14,6,2.147074610842727,0.5367686527106817,"duration: : , including product. ai , including generative ai, , processing. identify requirements needs. architectures volumes traffic. maintain applications. up-to-date ai cloud-native , improve outcomes. closely cross-functional , includ"
asaniczka_8b5956620944bbf9,kaggle_asaniczka,2024-01,"Mainframe Software Engineer I, II or Senior",Global Payments Inc.,mid-senior,2.0,llm,1840,12,1,0,0,0,0,none,14,3,6.521739130434782,0.0,"scrum include scrummaster, , , , counterparts capabilities , detailed user , , mock-ups, diagrams, outlining implemented non-functional requirements, architectures , adherence , implementing validating requirements adequately addressed part"
asaniczka_0bcd22333cb7e5a1,kaggle_asaniczka,2024-01,Quality Assurance Engineer,Sky Solutions,unknown,,llm,1804,11,0,0,2,1,2,none,14,3,6.097560975609756,1.1086474501108647,"provides mitigate defects increase , , ' end-to-end ' , , automation. architecting , , manual applications. demonstrates , , mentorship possessing programming/test set. prioritization , , activities. accomplished methodologies frequent rele"
linkedin_li-4367513192,scraped,2026-04,Senior Staff Software Engineer - Cloud,Brain Corp,mid-senior,3.0,llm,1755,6,2,2,2,1,0,none,14,6,3.4188034188034186,1.1396011396011396,"** ** : - ( ) ’ large-scale, high-availability ’ platform. , manages ingestion , , , insights. , contributing hands-on , , next-generation services. closely ml , , cloud-based volumes inference scale. ** :** | * , providing mentorship, , ma"
arshkon_3900959497,kaggle_arshkon,2024-04,Lead Automation Testing Developer,TekWissen ®,mid-senior,5.0,llm,1751,11,0,1,0,1,2,none,14,4,6.282124500285551,0.0,": language.pytest runner.pytest-fixtures initializing , consistent tests. including datasets.requests: http ™ http requests - flask simulating dependent microservices.saucelabs cloud. - appium ui devices.playwright ui appjob : mid-level , ,"
linkedin_li-4393153414,scraped,2026-03,"Senior Platform Engineer, Enterprise Data","Arrowstreet Capital, Limited Partnership",mid-senior,5.0,llm,1708,11,0,0,2,0,1,none,14,3,6.4402810304449645,1.17096018735363,"** ** | hands-on , , platform. , participate bring analytics. closely colleagues understand improve contribute optimizing , including endpoints adapted requirements. ci/cd, infrastructure-as-code, , , observability , closely including , tea"
linkedin_li-4372651079,scraped,2026-04,Sr. Site Reliability Engineer,PitchBook,mid-senior,5.0,llm,1680,11,0,1,0,1,0,none,14,4,6.5476190476190474,0.0,"( ) ’ , evolving automatically reliably consistently. conjunction , objectives (slos) determine objectives. utilize , , maintaining , operate large-scale integrations. incorporate observability ( , , tracing, alerting), , , eliminate failur"
linkedin_li-4387785425,scraped,2026-03,Senior Software Engineer - Cloud Fullstack,Rivian and Volkswagen Group Technologies,mid-senior,2.0,llm,1680,11,0,0,1,1,1,none,14,4,6.5476190476190474,0.5952380952380952,"** summary** | ** ( ) ** massively robust ingress egress vehicles. openings throughput , , updates. operate communicate cloud. next ( ) r \| designing, , maintaining high-performance, low-latency, robust, , systems. r \| ’ , collaborating c"
asaniczka_473a24ccb99de7bb,kaggle_asaniczka,2024-01,Software Architect,Snap-on,mid-senior,3.0,llm,1597,10,0,0,2,1,1,none,14,4,6.261740763932373,1.2523481527864746,", , intranet, extranet, client-server c# , mature process. , , qualities. expect contributing , mentorship, ambitious roadmap services. | , members. cross-functional understand requirements translate offline-first client-server c# applicati"
asaniczka_027bca82ca74e527,kaggle_asaniczka,2024-01,"Staff Machine Learning Engineer, Series A",Commitment Full-time,mid-senior,1.0,llm,1588,6,2,1,3,0,1,phd,14,6,3.7783375314861463,1.8891687657430731,"all. biomarker depression speech. ' , researchers cutting-edge models. ml , communicate recent findings, , requirements ml team. seamlessly ml production. , ' clinically validated datasets. ml core-product including investigating, , executi"
arshkon_3903832206,kaggle_arshkon,2024-04,Full Stack Java Developer,CACI International Inc,unknown,7.0,llm,1579,11,0,1,0,0,2,bs,14,4,6.966434452184927,0.0,"percentage : % : worked delivering deployable sprints. scrum providing releasable cycles. customer-defined developers/engineers, , users processes. designing, , implementing capabilities modernized oversightacting collaborating takes succes"
linkedin_li-4328994065,scraped,2026-04,"(USA) Principal, Software Engineer",Walmart,mid-senior,3.0,llm,1555,5,4,1,3,0,2,none,14,5,3.215434083601286,1.9292604501607717,"summary... next ’ engineering. , , ai/ml proactively , , ’ platforms. operate , , —translating actionable tangible ' do... | ai/ml \& * , fine-tune, generative ai (including llms) (e.g., , ai) , , remediation. * llm-based multi-step , groun"
linkedin_li-4392263862,scraped,2026-03,.Net Full Stack Developer,Infosys,mid-senior,4.0,llm,1550,12,0,0,1,0,0,none,14,3,7.741935483870968,0.6451612903225806,"** -** , proficiency including requirements elicitation, design. important high-level artifacts. deliverables module, types , , warranty. * bachelor’ institution. lieu * commuting , willing relocate area. require locations * employer-based "
