uid,company,title,first_match_word,match_excerpt
linkedin_li-4400655494,UT MD Anderson,Senior Data Engineer - Healthcare AI,vector store,"pliance requirements, combined with advanced technical proficiency in cloud platforms, orchestration tools, and feature/vector store management. This individual thrives in collaborative environments, demonstrates leadership in mentoring others, and is"
linkedin_li-4396021907,Children's Hospital Colorado,Azure Software Engineer Professional,Github Copilot,ure is also preferred + Preference will be given to those applicants who have experience with AI Code generation tools: Github Copilot and Claude Code. + Building AI solutions with systems that leverage Retrieval Augmented Generation is a plus. * EQUIVA
linkedin_li-4388729488,Optum,Software Engineer,AI tooling,"to documentation including process design documents, runbooks, and knowledge base articles * Stay current with emerging AI tooling, LLM integrations, and automation platform capabilities (UiPath, Azure AI, etc.) * Identify opportunities to enhance ex"
linkedin_li-4389775028,Optum,Lead Software Quality Engineer - Remote,AI-assisted,"able, performance degradation) and ensure signals are actionable for operations and releases * Apply or experiment with AI-assisted testing (e.g., test generation/maintenance, intelligent test selection, anomaly detection) to improve automation effect"
linkedin_li-4394346287,Counsel Health,Senior Mobile Engineer (Founding),AI-powered,n iOS and Android. What you’ll do * Develop patient-facing features on our mobile app to enhance our AI-powered care delivery experience * Build and lead a high-performing mobile engineering team to shape the future of our mobile a
linkedin_li-4383513339,Verily,"Senior Software Engineer, ML Infra",RAG,"we are building AI tools for our care products to improve the patient experience, with a focus on agent infrastructure, RAG (Retrieval-Augmented Generation) systems, and specialized components like embedding stores and LLM orchestration tools"
linkedin_li-4388681789,Enigma,"Machine Learning Engineer | Python | Pytorch | Distributed Training | Optimisation | GPU | Hybrid, San Jose, CA",ML Ops,"n. * Define and track performance and cost KPIs; run continuous improvement loops and capacity planning. * Partner with ML Ops on CI/CD, telemetry/observability, model registries; partner with Scientists on reproducible handoffs and evaluations."
linkedin_li-4397367869,CVS Health,Staff Software Development Engineer,LLM,"You'll architect and deliver core platform services including workflow orchestration engines, multi-provider LLM integration, automated deployment pipelines, and production observability infrastructure. Your work will directly reduc"
linkedin_li-4393570626,Michigan Medicine,Data Engineer Senior,agentic,"n control and CI/CD workflows (GitLab CI or equivalent). * Demonstrated proficiency with AI and experience working with agentic coding tools (e.g., Cursor, OpenAI Codex, Claude Code, Anti-Gravity) to accelerate development workflows. * Excellent a"
linkedin_li-4402765672,Eventus WholeHealth,Systems Integration Engineer,AI-assisted,"with structured data and writing queries (e.g., SQL) Experience with version control systems (e.g., Git) and AI-assisted development tools (e.g., Claude Code or similar)"
linkedin_li-4383909900,Swoop,"Staff AI/ML Engineer, MyHealthTeam",LLM,". We’re looking for a Staff AI/ML Engineer who is product-minded, hands-on, and excited to ship production ML/LLM systems that turn messy, real-world text and behavioral data into reliable experiences for patients. **What Yo"
linkedin_li-4390679762,CVS Health,Principal Software Engineer (Health100 Platform),generative AI,"gineering practices for security, resiliency, availability, and scalability in production systems. * Experience with AI/generative AI solutions and technologies. **Preferred Qualifications** * Experience in the health, wellness, or pharmacy domain. * C"
linkedin_li-4392088915,Optum,Senior Site Reliability Engineer,AI-assisted,"y establishing patterns for engineering excellence initiatives (zero-downtime deployments, automated remediation) * Use AI-assisted tooling to improve engineering productivity (e.g., incident analysis, automation, and documentation) * Provide 24×7 pro"
linkedin_li-4395172294,MindCare Solutions,Senior Healthcare Microsoft Dynamics 365 | Microsoft Cloud for Healthcare Platform Engineer,Agentic,"ble, event-driven architectures * Enable API-first access to healthcare data and workflows ****Intelligent Automation, Agentic AI \& Platform Extensions**** * Design and implement agentic AI-enabled workflows for care coordination and patient eng"
linkedin_li-4372232413,DeepRec.ai,Senior Machine Learning Engineer,GenAI,"Senior Machine Learning Engineer (GenAI and Agentic Systems) **Location:** Palo Alto, CA (Hybrid ) **Role Type:** Full-Time / Permanent Summary"
linkedin_li-4395256991,Athelas,Business Systems Engineer,AI-powered,"achieved over 300% year-over-year growth for the past two years and this is only the beginning. Healthcare's moment for AI-powered transformation is here, and we're building the technology to power it. Come join us in shaping the future of healthcare"
linkedin_li-4400648385,SmithRx,"Software Engineer, AI, Platform",LLM,"nal MLE role; we are looking for a product-focused, versatile engineer who can help bridge the gap between cutting-edge LLM capabilities and reliable, production-grade software. You will help build and scale systems that leverage the power of"
linkedin_li-4326551365,Maven Clinic,Staff Software Engineer - Security,AI-assisted,"access reviews, and approvals * Integrate software-supply-chain security (SBOM, dependency scanning) * Develop or adopt AI-assisted security tooling to proactively identify risks * Automate policy enforcement, SAST/DAST scans, and compliance verificat"
linkedin_li-4371187684,Hearst Health,AI Software Engineer,LLM,"te delivery. * This position will be based Hybrid in Tampa, FL. **Responsibilities:** * Design and develop AI/LLM-powered solutions to automate software engineering tasks, such as test case identification, code review assistance, and"
linkedin_li-4378539554,Memorial Sloan Kettering Cancer Center,Bioinformatics Software Engineer,RAG,"b portals. * Design and build AI/ML solutions - including large language models (LLMs), retrieval-augmented generation (RAG), deep learning, and classical ML - integrated into secure, scalable full-stack clinical applications. **Key Qualifica"
linkedin_li-4384393251,Omnicell,"Engineer III, Software",prompt engineering,"use AI tools for software design, development, analysis, testing, and documentation * Experience or strong interest in prompt engineering—crafting prompts, validating output, and refining AI‑assisted workflows * AI literacy: ability to understand AI strengt"
linkedin_li-4306887317,HCA Healthcare,Staff Data Engineer,AI-assisted,"neer will be expected to leverage AI-native workflows to accelerate solution delivery. This includes the ability to use AI-assisted development tools for rapid software engineering, apply modern AI building blocks such as prompting, retrieval-augmente"
linkedin_li-4398537653,Optum,Senior AI/ML Engineer - Remote,OpenAI,"us on natural language processing (NLP) and Language Models * 3\+ years of experience with libraries such as Langchain, OpenAI API, Hugging Face Transformers, or similar tools for finetuning and integrating LLMs * Experience with agentic framewor"
linkedin_li-4374834267,SCAN,Cloud Platform Engineer,LLM,"t the platform level (e.g., deploying and operating models via Azure ML, containerized inference services, or API-based LLM integrations). * Drive resilience and disaster recovery strategies, including backup, failover, and multi-region design"
linkedin_li-4378613835,Elevance Health,Gen AI Engineer,LLM,"data extraction, transformation and loading techniques in order to connect large data sets from a variety of sources. * LLM development and fine-tuning strategies, best practices, and standards to enhance AI ML model deployment and monitoring"
linkedin_li-4400933352,Optum,Senior Data Engineer - Remote,LLM,"data quality frameworks, auditability, and reconciliation controls in regulated data environments * Experience using AI/LLM models to support data engineering (eg, accelerating SQL/ETL development, automating documentation, enabling data quali"
linkedin_li-4394609273,The US Oncology Network,"Remote Oncology Data Engineer - Precision Medicine - Dallas, Tx",OpenAI,"es, the Oncology Data Engineer will create scalable and efficient solutions using innovative technology, including SQL, OpenAI tools and large language models (LLMs). Supports and adheres to US Oncology Compliance Program, to include the Code of"
linkedin_li-4392258639,Texas Oncology,"Senior Data Engineer - Precision Health Informatics - Dallas, Tx",LLM,g PHI protection and risk modeling. * Translate clinical and research needs into scalable technical solutions. AI and LLM Integration * Integrate AI and LLM capabilities into data platforms and collaborate with AI teams on implement
linkedin_li-4388743047,Optum,Associate Software Engineer,AI-powered,"ture by demonstrating curiosity, collaboration, and servant‑leadership-oriented behaviors * Design, develop, and deploy AI-powered solutions to address complex business challenges with emphasis on responsible use of AI You'll be rewarded and recogn"
linkedin_li-4396962518,Counsel Health,Senior Software Engineer (Fullstack),MLOps,"ork spans a range of disciplines, including full-stack web development, data infrastructure, mobile development, and AI/MLOps. Our culture is fast-paced and ambitious, and we aim for every team member to be exceptional. **What You'll Do"
